[2025-07-04 15:43:02,966] INFO: Starting universe processing pipeline...
[2025-07-04 15:43:02,974] INFO: 
No new or modified files to process. The Parquet file is up-to-date.
[2025-07-04 15:43:02,974] INFO: Universe processing pipeline finished successfully.
[2025-07-04 15:43:03,005] ERROR: Universe processing pipeline failed.: [Errno 2] No such file or directory: 'C:\\Users\\Eddy\\YTM Capital Dropbox\\Eddy Winiarz\\Trading\\COF\\Models\\Unfinished Models\\Eddy\\Python Projects\\work_supa\\universe\\universe.parquet'
Traceback (most recent call last):
  File "C:\Users\Eddy\YTM Capital Dropbox\Eddy Winiarz\Trading\COF\Models\Unfinished Models\Eddy\Python Projects\work_supa\universe\universe_raw_to_parquet.py", line 39, in <module>
    df = pd.read_parquet(parquet_path)
         ^^^^^^^^^^^^^^^^^^^^^^^^^^^^^
  File "C:\Users\Eddy\AppData\Local\pypoetry\Cache\virtualenvs\auto-ml-GtY3jPFV-py3.11\Lib\site-packages\pandas\io\parquet.py", line 503, in read_parquet
    return impl.read(
           ^^^^^^^^^^
  File "C:\Users\Eddy\AppData\Local\pypoetry\Cache\virtualenvs\auto-ml-GtY3jPFV-py3.11\Lib\site-packages\pandas\io\parquet.py", line 244, in read
    path_or_handle, handles, kwargs["filesystem"] = _get_path_or_handle(
                                                    ^^^^^^^^^^^^^^^^^^^^
  File "C:\Users\Eddy\AppData\Local\pypoetry\Cache\virtualenvs\auto-ml-GtY3jPFV-py3.11\Lib\site-packages\pandas\io\parquet.py", line 102, in _get_path_or_handle
    handles = get_handle(
              ^^^^^^^^^^^
  File "C:\Users\Eddy\AppData\Local\pypoetry\Cache\virtualenvs\auto-ml-GtY3jPFV-py3.11\Lib\site-packages\pandas\io\common.py", line 865, in get_handle
    handle = open(handle, ioargs.mode)
             ^^^^^^^^^^^^^^^^^^^^^^^^^
FileNotFoundError: [Errno 2] No such file or directory: 'C:\\Users\\Eddy\\YTM Capital Dropbox\\Eddy Winiarz\\Trading\\COF\\Models\\Unfinished Models\\Eddy\\Python Projects\\work_supa\\universe\\universe.parquet'
[2025-07-04 15:46:42,968] INFO: Starting universe processing pipeline...
[2025-07-04 15:46:42,977] DEBUG: Found new file to process: 'API 05.23.25.xlsx'
[2025-07-04 15:46:42,977] DEBUG: Found new file to process: 'API 05.26.25.xlsx'
[2025-07-04 15:46:42,977] DEBUG: Found new file to process: 'API 05.28.25.xlsx'
[2025-07-04 15:46:42,978] DEBUG: Found new file to process: 'API 06.03.25.xlsx'
[2025-07-04 15:46:42,978] DEBUG: Found new file to process: 'API 06.06.25.xlsx'
[2025-07-04 15:46:42,978] DEBUG: Found new file to process: 'API 06.10.25.xlsx'
[2025-07-04 15:46:42,978] DEBUG: Found new file to process: 'API 06.11.25.xlsx'
[2025-07-04 15:46:42,978] DEBUG: Found new file to process: 'API 06.20.25.xlsx'
[2025-07-04 15:46:42,978] DEBUG: Found new file to process: 'API 06.26.25.xlsx'
[2025-07-04 15:46:42,978] DEBUG: Found new file to process: 'API 06.30.25.xlsx'
[2025-07-04 15:46:42,978] DEBUG: Found new file to process: 'API 08.04.23.xlsx'
[2025-07-04 15:46:42,979] DEBUG: Found new file to process: 'API 10.31.23.xlsx'
[2025-07-04 15:46:42,979] DEBUG: Found new file to process: 'API 12.20.24.xlsx'
[2025-07-04 15:46:42,979] DEBUG: Found new file to process: 'API 12.29.23.xlsx'
[2025-07-04 15:46:42,979] INFO: 
Found 14 files to process...
[2025-07-04 15:46:42,979] INFO: Processing 'API 05.23.25.xlsx'...
[2025-07-04 15:46:42,983] INFO:   Extracted date: 2025-05-23 (datetime type)
[2025-07-04 15:46:45,118] INFO:   Added Date column with dtype: datetime64[ns]
[2025-07-04 15:46:45,119] INFO:   Processed shape: (2714, 76)
[2025-07-04 15:46:45,119] INFO: Processing 'API 05.26.25.xlsx'...
[2025-07-04 15:46:45,119] INFO:   Extracted date: 2025-05-26 (datetime type)
[2025-07-04 15:46:46,276] INFO:   Added Date column with dtype: datetime64[ns]
[2025-07-04 15:46:46,276] INFO:   Processed shape: (2715, 76)
[2025-07-04 15:46:46,276] INFO: Processing 'API 05.28.25.xlsx'...
[2025-07-04 15:46:46,276] INFO:   Extracted date: 2025-05-28 (datetime type)
[2025-07-04 15:46:47,439] INFO:   Added Date column with dtype: datetime64[ns]
[2025-07-04 15:46:47,439] INFO:   Processed shape: (2722, 76)
[2025-07-04 15:46:47,441] INFO: Processing 'API 06.03.25.xlsx'...
[2025-07-04 15:46:47,441] INFO:   Extracted date: 2025-06-03 (datetime type)
[2025-07-04 15:46:48,607] INFO:   Added Date column with dtype: datetime64[ns]
[2025-07-04 15:46:48,607] INFO:   Processed shape: (2754, 76)
[2025-07-04 15:46:48,607] INFO: Processing 'API 06.06.25.xlsx'...
[2025-07-04 15:46:48,608] INFO:   Extracted date: 2025-06-06 (datetime type)
[2025-07-04 15:46:49,793] INFO:   Added Date column with dtype: datetime64[ns]
[2025-07-04 15:46:49,793] INFO:   Processed shape: (2760, 76)
[2025-07-04 15:46:49,793] INFO: Processing 'API 06.10.25.xlsx'...
[2025-07-04 15:46:49,793] INFO:   Extracted date: 2025-06-10 (datetime type)
[2025-07-04 15:46:50,959] INFO:   Added Date column with dtype: datetime64[ns]
[2025-07-04 15:46:50,959] INFO:   Processed shape: (2764, 76)
[2025-07-04 15:46:50,959] INFO: Processing 'API 06.11.25.xlsx'...
[2025-07-04 15:46:50,959] INFO:   Extracted date: 2025-06-11 (datetime type)
[2025-07-04 15:46:52,147] INFO:   Added Date column with dtype: datetime64[ns]
[2025-07-04 15:46:52,147] INFO:   Processed shape: (2765, 76)
[2025-07-04 15:46:52,147] INFO: Processing 'API 06.20.25.xlsx'...
[2025-07-04 15:46:52,147] INFO:   Extracted date: 2025-06-20 (datetime type)
[2025-07-04 15:46:53,377] INFO:   Added Date column with dtype: datetime64[ns]
[2025-07-04 15:46:53,377] INFO:   Processed shape: (2794, 76)
[2025-07-04 15:46:53,377] INFO: Processing 'API 06.26.25.xlsx'...
[2025-07-04 15:46:53,377] INFO:   Extracted date: 2025-06-26 (datetime type)
[2025-07-04 15:46:54,384] INFO:   Added Date column with dtype: datetime64[ns]
[2025-07-04 15:46:54,384] INFO:   Processed shape: (2294, 76)
[2025-07-04 15:46:54,384] INFO: Processing 'API 06.30.25.xlsx'...
[2025-07-04 15:46:54,384] INFO:   Extracted date: 2025-06-30 (datetime type)
[2025-07-04 15:46:55,377] INFO:   Added Date column with dtype: datetime64[ns]
[2025-07-04 15:46:55,379] INFO:   Processed shape: (2294, 76)
[2025-07-04 15:46:55,379] INFO: Processing 'API 08.04.23.xlsx'...
[2025-07-04 15:46:55,379] INFO:   Extracted date: 2023-08-04 (datetime type)
[2025-07-04 15:46:56,083] INFO:   Added Date column with dtype: datetime64[ns]
[2025-07-04 15:46:56,083] INFO:   Processed shape: (1929, 60)
[2025-07-04 15:46:56,084] INFO: Processing 'API 10.31.23.xlsx'...
[2025-07-04 15:46:56,084] INFO:   Extracted date: 2023-10-31 (datetime type)
[2025-07-04 15:46:56,779] INFO:   Added Date column with dtype: datetime64[ns]
[2025-07-04 15:46:56,779] INFO:   Processed shape: (2020, 60)
[2025-07-04 15:46:56,781] INFO: Processing 'API 12.20.24.xlsx'...
[2025-07-04 15:46:56,781] INFO:   Extracted date: 2024-12-20 (datetime type)
[2025-07-04 15:46:57,795] INFO:   Added Date column with dtype: datetime64[ns]
[2025-07-04 15:46:57,795] INFO:   Processed shape: (2400, 76)
[2025-07-04 15:46:57,795] INFO: Processing 'API 12.29.23.xlsx'...
[2025-07-04 15:46:57,795] INFO:   Extracted date: 2023-12-29 (datetime type)
[2025-07-04 15:46:58,564] INFO:   Added Date column with dtype: datetime64[ns]
[2025-07-04 15:46:58,564] INFO:   Processed shape: (2097, 61)
[2025-07-04 15:46:58,586] INFO: 
--- Starting Data Processing Pipeline ---
[2025-07-04 15:46:58,671] INFO: Dropped 0 rows with null CUSIPs.
[2025-07-04 15:46:58,751] INFO: Dropped 644 duplicate (Date, CUSIP) rows.
[2025-07-04 15:46:58,752] INFO: --- Running Data Validation and Quality Analysis ---
[2025-07-04 15:47:00,098] WARNING: 
=========================
=== VALIDATION ERRORS ===
=========================

--- Non-Numeric Data in Numeric Columns ---
  - Column 'Stochastic Duration': Found 28549 non-numeric entries.
  - Column 'Stochastic Convexity': Found 28549 non-numeric entries.
  - Column 'MTD Return': Found 2598 non-numeric entries.
  - Column 'QTD Return': Found 2283 non-numeric entries.
  - Column 'YTD Return': Found 1474 non-numeric entries.
  - Column 'MTD Bench Return': Found 1644 non-numeric entries.
  - Column 'QTD Bench Return': Found 1576 non-numeric entries.
  - Column 'YTD Bench Return': Found 982 non-numeric entries.
  - Column 'Yrs (Worst)': Found 5515 non-numeric entries.
  - Column 'YTC': Found 2592 non-numeric entries.
  - Column 'G Sprd': Found 3160 non-numeric entries.
  - Column 'Yrs (Cvn)': Found 4726 non-numeric entries.
  - Column 'OAS (Mid)': Found 1521 non-numeric entries.
  - Column 'CAD Equiv Swap': Found 2580 non-numeric entries.
  - Column 'Yrs Since Issue': Found 2452 non-numeric entries.
  - Column 'Yrs (Mat)': Found 4231 non-numeric entries.
  - Column 'Z Spread': Found 5151 non-numeric entries.
[2025-07-04 15:47:00,108] INFO: 
=========================
=== DATA QUALITY REPORT ===
=========================

--- Null Value Analysis (Top 5) ---
  - BI Interp: 34378.0 nulls (100.00%)
  - B/E Bench Sprd: 34378.0 nulls (100.00%)
  - Forward Sprd: 34378.0 nulls (100.00%)
  - Yrs Since Isssue: 32317.0 nulls (94.00%)
  - Retracement24: 27432.0 nulls (79.80%)

--- Statistical Summary (Numeric Columns) ---
                          count          mean             std        min     25%     50%     75%                max
Stochastic Duration    5,036.00          3.86            3.01       0.00    1.76    3.19    5.03              15.83
Stochastic Convexity   5,036.00         -1.57            5.66     -92.61   -0.09    0.04    0.15               6.95
MTD Return            28,456.00          0.09           10.69     -22.95   -0.34    0.05    0.37           1,784.13
QTD Return            28,094.00          0.52           15.85     -26.98   -0.32    0.45    0.79           1,784.13
YTD Return            26,803.00          2.54           21.22     -50.93    1.26    2.04    2.87           2,170.15
MTD Bench Return      19,001.00         -0.61            1.87      -5.99   -0.97   -0.24    0.04               8.08
QTD Bench Return      19,069.00         -1.14            4.09      -9.64   -1.91   -0.29    0.32              19.62
YTD Bench Return      19,663.00          0.28            3.12      -8.81   -0.75    1.40    1.71              11.66
Yrs (Worst)           28,676.00        101.53          234.83  -2,889.74   29.80   76.16  121.40           8,115.43
YTC                   28,587.00          4.76            2.32     -24.55    3.82    4.69    5.29              77.92
Excess MTD            26,218.00          0.39            0.68     -17.66    0.04    0.20    0.58              17.46
Excess YTD            23,414.00          0.64            1.91     -27.16    0.00    0.34    1.06              41.60
G Sprd                27,442.00  7,825,678.58  409,874,360.29  -7,195.32   74.58  114.99  162.01  21,474,836,480.00
Yrs (Cvn)             29,652.00          7.62            8.91       0.00    1.86    4.03    8.44              57.71
OAS (Mid)             32,840.00        159.50          162.88    -455.83  118.49  156.10  158.53           4,868.32
CAD Equiv Swap        28,172.00        124.33          225.24  -2,972.81   60.51  100.99  137.17           6,190.23
YTD Equity            24,875.00          6.70           14.69     -87.32   -1.67    5.02   13.29             181.24
MTD Equity            24,884.00          1.16            5.52     -37.86   -2.01    0.36    3.87              46.33
Yrs Since Issue       25,981.00          3.86            3.44      -0.05    1.28    3.18    5.22              30.88
Risk                  23,333.00        498.58          425.85       0.27  178.79  366.74  697.60           2,064.86
Yrs (Mat)             24,202.00          9.85           12.52       0.00    2.20    4.67   10.20              60.20
Z Spread              23,230.00        149.30          256.83  -2,745.44   78.98  122.13  163.87           8,160.01

--- Categorical Value Distribution (Sample) ---
  - Column 'CUSIP':
    '78460TAK1': 14 (0.04%)
    '44810ZCM0': 14 (0.04%)
    '44331LAB7': 14 (0.04%)
  - Column 'Benchmark Cusip':
    '135087M68': 4004 (11.65%)
    '135087F82': 1103 (3.21%)
    '135087H23': 938 (2.73%)
  - Column 'Custom_Sector':
    'Auto': 3148 (9.16%)
    'Utility': 2845 (8.28%)
    'Financial Maples': 2823 (8.21%)
[2025-07-04 15:47:00,109] DEBUG: Creating bucket for 'Yrs Since Issue'...
[2025-07-04 15:47:00,115] DEBUG: Creating bucket for 'Yrs (Mat)'...
[2025-07-04 15:47:00,263] INFO: 
=========================
=== FINAL DATA SNAPSHOT ===
=========================
Total Rows: 34378
Total Columns: 47
Memory Usage: 70.21 MB

--- DataFrame Info ---
<class 'pandas.core.frame.DataFrame'>
Int64Index: 34378 entries, 26889 to 24402
Columns: 47 entries, Date to Yrs (Mat) Bucket
dtypes: category(2), datetime64[ns](1), object(44)
memory usage: 12.1+ MB

[2025-07-04 15:47:01,279] INFO: --- Processing Complete ---
[2025-07-04 15:47:01,279] INFO: Final DataFrame Shape: (34378, 47)
[2025-07-04 15:47:01,280] INFO: 
=========================
[2025-07-04 15:47:01,282] INFO: === DATE COVERAGE ANALYSIS ===
[2025-07-04 15:47:01,282] INFO: =========================
[2025-07-04 15:47:01,282] INFO: Total unique dates: 14
[2025-07-04 15:47:01,282] INFO: Date column dtype: datetime64[ns]
[2025-07-04 15:47:01,283] INFO: Date range: 2023-08-04 to 2025-06-30
[2025-07-04 15:47:01,285] INFO: Time span: 696 days (1.9 years)
[2025-07-04 15:47:01,322] INFO: 
Year distribution:
[2025-07-04 15:47:01,322] INFO:   - 2023: 5945 records
[2025-07-04 15:47:01,322] INFO:   - 2024: 2353 records
[2025-07-04 15:47:01,322] INFO:   - 2025: 26080 records
[2025-07-04 15:47:01,340] INFO: 
Business day analysis:
[2025-07-04 15:47:01,340] INFO:   - Business days: 34378 (100.0%)
[2025-07-04 15:47:01,340] INFO:   - Weekend days: 0 (0.0%)
[2025-07-04 15:47:01,340] INFO: 
Sample dates:
[2025-07-04 15:47:01,341] INFO:   - 2023-08-04 (Fri): 1897 records
[2025-07-04 15:47:01,341] INFO:   - 2023-10-31 (Tue): 1987 records
[2025-07-04 15:47:01,342] INFO:   - 2023-12-29 (Fri): 2061 records
[2025-07-04 15:47:01,342] INFO:   - 2024-12-20 (Fri): 2353 records
[2025-07-04 15:47:01,342] INFO:   - 2025-05-23 (Fri): 2664 records
[2025-07-04 15:47:01,343] INFO:   ... (4 more dates) ...
[2025-07-04 15:47:01,344] INFO:   - 2025-06-10 (Tue): 2714 records
[2025-07-04 15:47:01,344] INFO:   - 2025-06-11 (Wed): 2715 records
[2025-07-04 15:47:01,345] INFO:   - 2025-06-20 (Fri): 2742 records
[2025-07-04 15:47:01,345] INFO:   - 2025-06-26 (Thu): 2247 records
[2025-07-04 15:47:01,345] INFO:   - 2025-06-30 (Mon): 2247 records
[2025-07-04 15:47:01,346] INFO: 
=== END DATE ANALYSIS ===

[2025-07-04 15:47:01,387] INFO: DataFrame info before saving to Parquet:
<class 'pandas.core.frame.DataFrame'>
Int64Index: 34378 entries, 26889 to 24402
Data columns (total 47 columns):
 #   Column                  Non-Null Count  Dtype         
---  ------                  --------------  -----         
 0   Date                    34378 non-null  datetime64[ns]
 1   CUSIP                   34378 non-null  object        
 2   Benchmark Cusip         34378 non-null  object        
 3   Custom_Sector           34378 non-null  object        
 4   Marketing Sector        34378 non-null  object        
 5   Notes                   34378 non-null  object        
 6   Bloomberg Cusip         34378 non-null  object        
 7   Security                34378 non-null  object        
 8   Benchmark               34378 non-null  object        
 9   Make_Whole              22180 non-null  float64       
 10  Back End                5808 non-null   float64       
 11  Floating Index          34378 non-null  object        
 12  Stochastic Duration     5036 non-null   float64       
 13  Stochastic Convexity    5036 non-null   float64       
 14  Pricing Date            31775 non-null  datetime64[ns]
 15  Pricing Date (Bench)    20670 non-null  datetime64[ns]
 16  MTD Return              28456 non-null  float64       
 17  QTD Return              28094 non-null  float64       
 18  YTD Return              26803 non-null  float64       
 19  MTD Bench Return        19001 non-null  float64       
 20  QTD Bench Return        19069 non-null  float64       
 21  YTD Bench Return        19663 non-null  float64       
 22  Worst Date              31554 non-null  datetime64[ns]
 23  Yrs (Worst)             28676 non-null  float64       
 24  YTC                     28587 non-null  float64       
 25  Excess MTD              26218 non-null  float64       
 26  Excess YTD              23414 non-null  float64       
 27  CPN TYPE                34378 non-null  object        
 28  Ticker                  34378 non-null  object        
 29  G Sprd                  27442 non-null  float64       
 30  Yrs (Cvn)               29652 non-null  float64       
 31  OAS (Mid)               32840 non-null  float64       
 32  Currency                34378 non-null  object        
 33  CAD Equiv Swap          28172 non-null  float64       
 34  G (RBC Crv)             28134 non-null  float64       
 35  vs BI                   21776 non-null  float64       
 36  vs BCE                  28134 non-null  float64       
 37  Equity Ticker           34378 non-null  object        
 38  YTD Equity              24875 non-null  float64       
 39  MTD Equity              24884 non-null  float64       
 40  Yrs Since Issue         25981 non-null  float64       
 41  Risk                    34378 non-null  object        
 42  Rating                  34378 non-null  object        
 43  Yrs (Mat)               24202 non-null  float64       
 44  Z Spread                23230 non-null  float64       
 45  Yrs Since Issue Bucket  25893 non-null  category      
 46  Yrs (Mat) Bucket        24202 non-null  category      
dtypes: category(2), datetime64[ns](4), float64(26), object(15)
memory usage: 12.1+ MB

[2025-07-04 15:47:01,536] INFO: Successfully saved updated DataFrame to 'C:\Users\Eddy\YTM Capital Dropbox\Eddy Winiarz\Trading\COF\Models\Unfinished Models\Eddy\Python Projects\work_supa\universe\universe.parquet'.
[2025-07-04 15:47:01,536] INFO: Updated processing state file.
[2025-07-04 15:47:01,615] INFO: Universe processing pipeline finished successfully.
[2025-07-04 15:47:02,399] INFO: Exported processed data to CSV at 'C:\Users\Eddy\YTM Capital Dropbox\Eddy Winiarz\Trading\COF\Models\Unfinished Models\Eddy\Python Projects\work_supa\universe\processed data\universe_processed.csv'.
[2025-07-04 16:10:49,860] INFO: Starting universe processing pipeline...
[2025-07-04 16:10:49,869] DEBUG: Skipping 'API 05.23.25.xlsx' - already processed and unchanged
[2025-07-04 16:10:49,869] DEBUG: Skipping 'API 05.26.25.xlsx' - already processed and unchanged
[2025-07-04 16:10:49,869] DEBUG: Skipping 'API 05.28.25.xlsx' - already processed and unchanged
[2025-07-04 16:10:49,869] DEBUG: Skipping 'API 06.03.25.xlsx' - already processed and unchanged
[2025-07-04 16:10:49,869] DEBUG: Skipping 'API 06.06.25.xlsx' - already processed and unchanged
[2025-07-04 16:10:49,869] DEBUG: Skipping 'API 06.10.25.xlsx' - already processed and unchanged
[2025-07-04 16:10:49,869] DEBUG: Skipping 'API 06.11.25.xlsx' - already processed and unchanged
[2025-07-04 16:10:49,870] DEBUG: Skipping 'API 06.20.25.xlsx' - already processed and unchanged
[2025-07-04 16:10:49,870] DEBUG: Skipping 'API 06.26.25.xlsx' - already processed and unchanged
[2025-07-04 16:10:49,870] DEBUG: Skipping 'API 06.30.25.xlsx' - already processed and unchanged
[2025-07-04 16:10:49,870] DEBUG: Skipping 'API 08.04.23.xlsx' - already processed and unchanged
[2025-07-04 16:10:49,870] DEBUG: Skipping 'API 10.31.23.xlsx' - already processed and unchanged
[2025-07-04 16:10:49,870] DEBUG: Skipping 'API 12.20.24.xlsx' - already processed and unchanged
[2025-07-04 16:10:49,870] DEBUG: Skipping 'API 12.29.23.xlsx' - already processed and unchanged
[2025-07-04 16:10:49,870] INFO: Found existing Parquet file. Loading for incremental processing...
[2025-07-04 16:10:49,982] INFO: Loaded existing data: 34378 rows, 47 columns
[2025-07-04 16:10:50,017] INFO: DataFrame info after loading from Parquet:
<class 'pandas.core.frame.DataFrame'>
RangeIndex: 34378 entries, 0 to 34377
Data columns (total 47 columns):
 #   Column                  Non-Null Count  Dtype         
---  ------                  --------------  -----         
 0   Date                    34378 non-null  datetime64[ns]
 1   CUSIP                   34378 non-null  object        
 2   Benchmark Cusip         34378 non-null  object        
 3   Custom_Sector           34378 non-null  object        
 4   Marketing Sector        34378 non-null  object        
 5   Notes                   34378 non-null  object        
 6   Bloomberg Cusip         34378 non-null  object        
 7   Security                34378 non-null  object        
 8   Benchmark               34378 non-null  object        
 9   Make_Whole              22180 non-null  float64       
 10  Back End                5808 non-null   float64       
 11  Floating Index          34378 non-null  object        
 12  Stochastic Duration     5036 non-null   float64       
 13  Stochastic Convexity    5036 non-null   float64       
 14  Pricing Date            31775 non-null  datetime64[ns]
 15  Pricing Date (Bench)    20670 non-null  datetime64[ns]
 16  MTD Return              28456 non-null  float64       
 17  QTD Return              28094 non-null  float64       
 18  YTD Return              26803 non-null  float64       
 19  MTD Bench Return        19001 non-null  float64       
 20  QTD Bench Return        19069 non-null  float64       
 21  YTD Bench Return        19663 non-null  float64       
 22  Worst Date              31554 non-null  datetime64[ns]
 23  Yrs (Worst)             28676 non-null  float64       
 24  YTC                     28587 non-null  float64       
 25  Excess MTD              26218 non-null  float64       
 26  Excess YTD              23414 non-null  float64       
 27  CPN TYPE                34378 non-null  object        
 28  Ticker                  34378 non-null  object        
 29  G Sprd                  27442 non-null  float64       
 30  Yrs (Cvn)               29652 non-null  float64       
 31  OAS (Mid)               32840 non-null  float64       
 32  Currency                34378 non-null  object        
 33  CAD Equiv Swap          28172 non-null  float64       
 34  G (RBC Crv)             28134 non-null  float64       
 35  vs BI                   21776 non-null  float64       
 36  vs BCE                  28134 non-null  float64       
 37  Equity Ticker           34378 non-null  object        
 38  YTD Equity              24875 non-null  float64       
 39  MTD Equity              24884 non-null  float64       
 40  Yrs Since Issue         25981 non-null  float64       
 41  Risk                    34378 non-null  object        
 42  Rating                  34378 non-null  object        
 43  Yrs (Mat)               24202 non-null  float64       
 44  Z Spread                23230 non-null  float64       
 45  Yrs Since Issue Bucket  25893 non-null  category      
 46  Yrs (Mat) Bucket        24202 non-null  category      
dtypes: category(2), datetime64[ns](4), float64(26), object(15)
memory usage: 11.9+ MB

[2025-07-04 16:10:50,018] INFO: 
=========================
[2025-07-04 16:10:50,018] INFO: === EXISTING DATE COVERAGE ===
[2025-07-04 16:10:50,018] INFO: =========================
[2025-07-04 16:10:50,018] INFO: Total unique dates in existing data: 14
[2025-07-04 16:10:50,019] INFO: Existing date range: 2023-08-04T00:00:00.000000000 to 2025-06-30T00:00:00.000000000
[2025-07-04 16:10:50,019] INFO: Existing dates in Parquet:
[2025-07-04 16:10:50,019] INFO:   - 2023-08-04: 1897 records
[2025-07-04 16:10:50,019] INFO:   - 2023-10-31: 1987 records
[2025-07-04 16:10:50,020] INFO:   - 2023-12-29: 2061 records
[2025-07-04 16:10:50,020] INFO:   - 2024-12-20: 2353 records
[2025-07-04 16:10:50,020] INFO:   - 2025-05-23: 2664 records
[2025-07-04 16:10:50,020] INFO:   - 2025-05-26: 2665 records
[2025-07-04 16:10:50,021] INFO:   - 2025-05-28: 2672 records
[2025-07-04 16:10:50,021] INFO:   - 2025-06-03: 2704 records
[2025-07-04 16:10:50,021] INFO:   - 2025-06-06: 2710 records
[2025-07-04 16:10:50,021] INFO:   - 2025-06-10: 2714 records
[2025-07-04 16:10:50,022] INFO:   - 2025-06-11: 2715 records
[2025-07-04 16:10:50,024] INFO:   - 2025-06-20: 2742 records
[2025-07-04 16:10:50,025] INFO:   - 2025-06-26: 2247 records
[2025-07-04 16:10:50,025] INFO:   - 2025-06-30: 2247 records
[2025-07-04 16:10:50,025] INFO: 
No new or modified files to process. The Parquet file is up-to-date.
[2025-07-04 16:10:50,026] INFO: Universe processing pipeline finished successfully.
[2025-07-04 16:10:50,694] INFO: Exported processed data to CSV at 'C:\Users\Eddy\YTM Capital Dropbox\Eddy Winiarz\Trading\COF\Models\Unfinished Models\Eddy\Python Projects\work_supa\universe\processed data\universe_processed.csv'.
[2025-07-04 16:17:21,528] INFO: Starting universe processing pipeline...
[2025-07-04 16:17:21,540] DEBUG: Skipping 'API 05.23.25.xlsx' - already processed and unchanged
[2025-07-04 16:17:21,541] DEBUG: Skipping 'API 05.26.25.xlsx' - already processed and unchanged
[2025-07-04 16:17:21,541] DEBUG: Skipping 'API 05.28.25.xlsx' - already processed and unchanged
[2025-07-04 16:17:21,541] DEBUG: Skipping 'API 06.03.25.xlsx' - already processed and unchanged
[2025-07-04 16:17:21,541] DEBUG: Skipping 'API 06.06.25.xlsx' - already processed and unchanged
[2025-07-04 16:17:21,541] DEBUG: Skipping 'API 06.10.25.xlsx' - already processed and unchanged
[2025-07-04 16:17:21,541] DEBUG: Skipping 'API 06.11.25.xlsx' - already processed and unchanged
[2025-07-04 16:17:21,541] DEBUG: Skipping 'API 06.20.25.xlsx' - already processed and unchanged
[2025-07-04 16:17:21,541] DEBUG: Skipping 'API 06.26.25.xlsx' - already processed and unchanged
[2025-07-04 16:17:21,542] DEBUG: Skipping 'API 06.30.25.xlsx' - already processed and unchanged
[2025-07-04 16:17:21,542] DEBUG: Skipping 'API 08.04.23.xlsx' - already processed and unchanged
[2025-07-04 16:17:21,542] DEBUG: Skipping 'API 10.31.23.xlsx' - already processed and unchanged
[2025-07-04 16:17:21,542] DEBUG: Skipping 'API 12.20.24.xlsx' - already processed and unchanged
[2025-07-04 16:17:21,542] DEBUG: Skipping 'API 12.29.23.xlsx' - already processed and unchanged
[2025-07-04 16:17:21,542] INFO: Found existing Parquet file. Loading for incremental processing...
[2025-07-04 16:17:21,669] INFO: Loaded existing data: 34378 rows, 47 columns
[2025-07-04 16:17:21,708] INFO: DataFrame info after loading from Parquet:
<class 'pandas.core.frame.DataFrame'>
RangeIndex: 34378 entries, 0 to 34377
Data columns (total 47 columns):
 #   Column                  Non-Null Count  Dtype         
---  ------                  --------------  -----         
 0   Date                    34378 non-null  datetime64[ns]
 1   CUSIP                   34378 non-null  object        
 2   Benchmark Cusip         34378 non-null  object        
 3   Custom_Sector           34378 non-null  object        
 4   Marketing Sector        34378 non-null  object        
 5   Notes                   34378 non-null  object        
 6   Bloomberg Cusip         34378 non-null  object        
 7   Security                34378 non-null  object        
 8   Benchmark               34378 non-null  object        
 9   Make_Whole              22180 non-null  float64       
 10  Back End                5808 non-null   float64       
 11  Floating Index          34378 non-null  object        
 12  Stochastic Duration     5036 non-null   float64       
 13  Stochastic Convexity    5036 non-null   float64       
 14  Pricing Date            31775 non-null  datetime64[ns]
 15  Pricing Date (Bench)    20670 non-null  datetime64[ns]
 16  MTD Return              28456 non-null  float64       
 17  QTD Return              28094 non-null  float64       
 18  YTD Return              26803 non-null  float64       
 19  MTD Bench Return        19001 non-null  float64       
 20  QTD Bench Return        19069 non-null  float64       
 21  YTD Bench Return        19663 non-null  float64       
 22  Worst Date              31554 non-null  datetime64[ns]
 23  Yrs (Worst)             28676 non-null  float64       
 24  YTC                     28587 non-null  float64       
 25  Excess MTD              26218 non-null  float64       
 26  Excess YTD              23414 non-null  float64       
 27  CPN TYPE                34378 non-null  object        
 28  Ticker                  34378 non-null  object        
 29  G Sprd                  27442 non-null  float64       
 30  Yrs (Cvn)               29652 non-null  float64       
 31  OAS (Mid)               32840 non-null  float64       
 32  Currency                34378 non-null  object        
 33  CAD Equiv Swap          28172 non-null  float64       
 34  G (RBC Crv)             28134 non-null  float64       
 35  vs BI                   21776 non-null  float64       
 36  vs BCE                  28134 non-null  float64       
 37  Equity Ticker           34378 non-null  object        
 38  YTD Equity              24875 non-null  float64       
 39  MTD Equity              24884 non-null  float64       
 40  Yrs Since Issue         25981 non-null  float64       
 41  Risk                    34378 non-null  object        
 42  Rating                  34378 non-null  object        
 43  Yrs (Mat)               24202 non-null  float64       
 44  Z Spread                23230 non-null  float64       
 45  Yrs Since Issue Bucket  25893 non-null  category      
 46  Yrs (Mat) Bucket        24202 non-null  category      
dtypes: category(2), datetime64[ns](4), float64(26), object(15)
memory usage: 11.9+ MB

[2025-07-04 16:17:21,709] INFO: 
=========================
[2025-07-04 16:17:21,709] INFO: === EXISTING DATE COVERAGE ===
[2025-07-04 16:17:21,710] INFO: =========================
[2025-07-04 16:17:21,710] INFO: Total unique dates in existing data: 14
[2025-07-04 16:17:21,710] INFO: Existing date range: 2023-08-04T00:00:00.000000000 to 2025-06-30T00:00:00.000000000
[2025-07-04 16:17:21,710] INFO: Existing dates in Parquet:
[2025-07-04 16:17:21,711] INFO:   - 2023-08-04: 1897 records
[2025-07-04 16:17:21,711] INFO:   - 2023-10-31: 1987 records
[2025-07-04 16:17:21,711] INFO:   - 2023-12-29: 2061 records
[2025-07-04 16:17:21,712] INFO:   - 2024-12-20: 2353 records
[2025-07-04 16:17:21,712] INFO:   - 2025-05-23: 2664 records
[2025-07-04 16:17:21,712] INFO:   - 2025-05-26: 2665 records
[2025-07-04 16:17:21,713] INFO:   - 2025-05-28: 2672 records
[2025-07-04 16:17:21,714] INFO:   - 2025-06-03: 2704 records
[2025-07-04 16:17:21,715] INFO:   - 2025-06-06: 2710 records
[2025-07-04 16:17:21,715] INFO:   - 2025-06-10: 2714 records
[2025-07-04 16:17:21,715] INFO:   - 2025-06-11: 2715 records
[2025-07-04 16:17:21,716] INFO:   - 2025-06-20: 2742 records
[2025-07-04 16:17:21,716] INFO:   - 2025-06-26: 2247 records
[2025-07-04 16:17:21,716] INFO:   - 2025-06-30: 2247 records
[2025-07-04 16:17:21,716] INFO: 
No new or modified files to process. The Parquet file is up-to-date.
[2025-07-04 16:17:21,718] INFO: Universe processing pipeline finished successfully.
[2025-07-04 16:17:22,417] INFO: Exported processed data to CSV at 'C:\Users\Eddy\YTM Capital Dropbox\Eddy Winiarz\Trading\COF\Models\Unfinished Models\Eddy\Python Projects\work_supa\universe\processed data\universe_processed.csv'.
[2025-07-04 16:37:12,433] INFO: Starting universe processing pipeline...
[2025-07-04 16:37:12,444] DEBUG: Skipping 'API 05.23.25.xlsx' - already processed and unchanged
[2025-07-04 16:37:12,444] DEBUG: Skipping 'API 05.26.25.xlsx' - already processed and unchanged
[2025-07-04 16:37:12,444] DEBUG: Skipping 'API 05.28.25.xlsx' - already processed and unchanged
[2025-07-04 16:37:12,444] DEBUG: Skipping 'API 06.03.25.xlsx' - already processed and unchanged
[2025-07-04 16:37:12,444] DEBUG: Skipping 'API 06.06.25.xlsx' - already processed and unchanged
[2025-07-04 16:37:12,444] DEBUG: Skipping 'API 06.10.25.xlsx' - already processed and unchanged
[2025-07-04 16:37:12,444] DEBUG: Skipping 'API 06.11.25.xlsx' - already processed and unchanged
[2025-07-04 16:37:12,444] DEBUG: Skipping 'API 06.20.25.xlsx' - already processed and unchanged
[2025-07-04 16:37:12,444] DEBUG: Skipping 'API 06.26.25.xlsx' - already processed and unchanged
[2025-07-04 16:37:12,444] DEBUG: Skipping 'API 06.30.25.xlsx' - already processed and unchanged
[2025-07-04 16:37:12,444] DEBUG: Skipping 'API 08.04.23.xlsx' - already processed and unchanged
[2025-07-04 16:37:12,444] DEBUG: Skipping 'API 10.31.23.xlsx' - already processed and unchanged
[2025-07-04 16:37:12,444] DEBUG: Skipping 'API 12.20.24.xlsx' - already processed and unchanged
[2025-07-04 16:37:12,444] DEBUG: Skipping 'API 12.29.23.xlsx' - already processed and unchanged
[2025-07-04 16:37:12,444] INFO: Found existing Parquet file. Loading for incremental processing...
[2025-07-04 16:37:12,554] INFO: Loaded existing data: 34378 rows, 47 columns
[2025-07-04 16:37:12,589] INFO: DataFrame info after loading from Parquet:
<class 'pandas.core.frame.DataFrame'>
RangeIndex: 34378 entries, 0 to 34377
Data columns (total 47 columns):
 #   Column                  Non-Null Count  Dtype         
---  ------                  --------------  -----         
 0   Date                    34378 non-null  datetime64[ns]
 1   CUSIP                   34378 non-null  object        
 2   Benchmark Cusip         34378 non-null  object        
 3   Custom_Sector           34378 non-null  object        
 4   Marketing Sector        34378 non-null  object        
 5   Notes                   34378 non-null  object        
 6   Bloomberg Cusip         34378 non-null  object        
 7   Security                34378 non-null  object        
 8   Benchmark               34378 non-null  object        
 9   Make_Whole              22180 non-null  float64       
 10  Back End                5808 non-null   float64       
 11  Floating Index          34378 non-null  object        
 12  Stochastic Duration     5036 non-null   float64       
 13  Stochastic Convexity    5036 non-null   float64       
 14  Pricing Date            31775 non-null  datetime64[ns]
 15  Pricing Date (Bench)    20670 non-null  datetime64[ns]
 16  MTD Return              28456 non-null  float64       
 17  QTD Return              28094 non-null  float64       
 18  YTD Return              26803 non-null  float64       
 19  MTD Bench Return        19001 non-null  float64       
 20  QTD Bench Return        19069 non-null  float64       
 21  YTD Bench Return        19663 non-null  float64       
 22  Worst Date              31554 non-null  datetime64[ns]
 23  Yrs (Worst)             28676 non-null  float64       
 24  YTC                     28587 non-null  float64       
 25  Excess MTD              26218 non-null  float64       
 26  Excess YTD              23414 non-null  float64       
 27  CPN TYPE                34378 non-null  object        
 28  Ticker                  34378 non-null  object        
 29  G Sprd                  27442 non-null  float64       
 30  Yrs (Cvn)               29652 non-null  float64       
 31  OAS (Mid)               32840 non-null  float64       
 32  Currency                34378 non-null  object        
 33  CAD Equiv Swap          28172 non-null  float64       
 34  G (RBC Crv)             28134 non-null  float64       
 35  vs BI                   21776 non-null  float64       
 36  vs BCE                  28134 non-null  float64       
 37  Equity Ticker           34378 non-null  object        
 38  YTD Equity              24875 non-null  float64       
 39  MTD Equity              24884 non-null  float64       
 40  Yrs Since Issue         25981 non-null  float64       
 41  Risk                    34378 non-null  object        
 42  Rating                  34378 non-null  object        
 43  Yrs (Mat)               24202 non-null  float64       
 44  Z Spread                23230 non-null  float64       
 45  Yrs Since Issue Bucket  25893 non-null  category      
 46  Yrs (Mat) Bucket        24202 non-null  category      
dtypes: category(2), datetime64[ns](4), float64(26), object(15)
memory usage: 11.9+ MB

[2025-07-04 16:37:12,590] INFO: 
=========================
[2025-07-04 16:37:12,590] INFO: === EXISTING DATE COVERAGE ===
[2025-07-04 16:37:12,590] INFO: =========================
[2025-07-04 16:37:12,590] INFO: Total unique dates in existing data: 14
[2025-07-04 16:37:12,590] INFO: Existing date range: 2023-08-04T00:00:00.000000000 to 2025-06-30T00:00:00.000000000
[2025-07-04 16:37:12,590] INFO: Existing dates in Parquet:
[2025-07-04 16:37:12,591] INFO:   - 2023-08-04: 1897 records
[2025-07-04 16:37:12,591] INFO:   - 2023-10-31: 1987 records
[2025-07-04 16:37:12,591] INFO:   - 2023-12-29: 2061 records
[2025-07-04 16:37:12,591] INFO:   - 2024-12-20: 2353 records
[2025-07-04 16:37:12,592] INFO:   - 2025-05-23: 2664 records
[2025-07-04 16:37:12,592] INFO:   - 2025-05-26: 2665 records
[2025-07-04 16:37:12,592] INFO:   - 2025-05-28: 2672 records
[2025-07-04 16:37:12,592] INFO:   - 2025-06-03: 2704 records
[2025-07-04 16:37:12,592] INFO:   - 2025-06-06: 2710 records
[2025-07-04 16:37:12,592] INFO:   - 2025-06-10: 2714 records
[2025-07-04 16:37:12,592] INFO:   - 2025-06-11: 2715 records
[2025-07-04 16:37:12,592] INFO:   - 2025-06-20: 2742 records
[2025-07-04 16:37:12,592] INFO:   - 2025-06-26: 2247 records
[2025-07-04 16:37:12,592] INFO:   - 2025-06-30: 2247 records
[2025-07-04 16:37:12,592] INFO: 
No new or modified files to process. The Parquet file is up-to-date.
[2025-07-04 16:37:12,592] INFO: Universe processing pipeline finished successfully.
[2025-07-04 16:37:13,252] INFO: Exported processed data to CSV at 'C:\Users\Eddy\YTM Capital Dropbox\Eddy Winiarz\Trading\COF\Models\Unfinished Models\Eddy\Python Projects\work_supa\universe\processed data\universe_processed.csv'.
[2025-07-04 16:38:14,144] INFO: Starting universe processing pipeline...
[2025-07-04 16:38:14,154] DEBUG: Skipping 'API 05.23.25.xlsx' - already processed and unchanged
[2025-07-04 16:38:14,155] DEBUG: Skipping 'API 05.26.25.xlsx' - already processed and unchanged
[2025-07-04 16:38:14,155] DEBUG: Skipping 'API 05.28.25.xlsx' - already processed and unchanged
[2025-07-04 16:38:14,155] DEBUG: Skipping 'API 06.03.25.xlsx' - already processed and unchanged
[2025-07-04 16:38:14,155] DEBUG: Skipping 'API 06.06.25.xlsx' - already processed and unchanged
[2025-07-04 16:38:14,155] DEBUG: Skipping 'API 06.10.25.xlsx' - already processed and unchanged
[2025-07-04 16:38:14,155] DEBUG: Skipping 'API 06.11.25.xlsx' - already processed and unchanged
[2025-07-04 16:38:14,155] DEBUG: Skipping 'API 06.20.25.xlsx' - already processed and unchanged
[2025-07-04 16:38:14,155] DEBUG: Skipping 'API 06.26.25.xlsx' - already processed and unchanged
[2025-07-04 16:38:14,156] DEBUG: Skipping 'API 06.30.25.xlsx' - already processed and unchanged
[2025-07-04 16:38:14,156] DEBUG: Skipping 'API 08.04.23.xlsx' - already processed and unchanged
[2025-07-04 16:38:14,156] DEBUG: Skipping 'API 10.31.23.xlsx' - already processed and unchanged
[2025-07-04 16:38:14,156] DEBUG: Skipping 'API 12.20.24.xlsx' - already processed and unchanged
[2025-07-04 16:38:14,156] DEBUG: Skipping 'API 12.29.23.xlsx' - already processed and unchanged
[2025-07-04 16:38:14,156] INFO: Found existing Parquet file. Loading for incremental processing...
[2025-07-04 16:38:14,266] INFO: Loaded existing data: 34378 rows, 47 columns
[2025-07-04 16:38:14,300] INFO: DataFrame info after loading from Parquet:
<class 'pandas.core.frame.DataFrame'>
RangeIndex: 34378 entries, 0 to 34377
Data columns (total 47 columns):
 #   Column                  Non-Null Count  Dtype         
---  ------                  --------------  -----         
 0   Date                    34378 non-null  datetime64[ns]
 1   CUSIP                   34378 non-null  object        
 2   Benchmark Cusip         34378 non-null  object        
 3   Custom_Sector           34378 non-null  object        
 4   Marketing Sector        34378 non-null  object        
 5   Notes                   34378 non-null  object        
 6   Bloomberg Cusip         34378 non-null  object        
 7   Security                34378 non-null  object        
 8   Benchmark               34378 non-null  object        
 9   Make_Whole              22180 non-null  float64       
 10  Back End                5808 non-null   float64       
 11  Floating Index          34378 non-null  object        
 12  Stochastic Duration     5036 non-null   float64       
 13  Stochastic Convexity    5036 non-null   float64       
 14  Pricing Date            31775 non-null  datetime64[ns]
 15  Pricing Date (Bench)    20670 non-null  datetime64[ns]
 16  MTD Return              28456 non-null  float64       
 17  QTD Return              28094 non-null  float64       
 18  YTD Return              26803 non-null  float64       
 19  MTD Bench Return        19001 non-null  float64       
 20  QTD Bench Return        19069 non-null  float64       
 21  YTD Bench Return        19663 non-null  float64       
 22  Worst Date              31554 non-null  datetime64[ns]
 23  Yrs (Worst)             28676 non-null  float64       
 24  YTC                     28587 non-null  float64       
 25  Excess MTD              26218 non-null  float64       
 26  Excess YTD              23414 non-null  float64       
 27  CPN TYPE                34378 non-null  object        
 28  Ticker                  34378 non-null  object        
 29  G Sprd                  27442 non-null  float64       
 30  Yrs (Cvn)               29652 non-null  float64       
 31  OAS (Mid)               32840 non-null  float64       
 32  Currency                34378 non-null  object        
 33  CAD Equiv Swap          28172 non-null  float64       
 34  G (RBC Crv)             28134 non-null  float64       
 35  vs BI                   21776 non-null  float64       
 36  vs BCE                  28134 non-null  float64       
 37  Equity Ticker           34378 non-null  object        
 38  YTD Equity              24875 non-null  float64       
 39  MTD Equity              24884 non-null  float64       
 40  Yrs Since Issue         25981 non-null  float64       
 41  Risk                    34378 non-null  object        
 42  Rating                  34378 non-null  object        
 43  Yrs (Mat)               24202 non-null  float64       
 44  Z Spread                23230 non-null  float64       
 45  Yrs Since Issue Bucket  25893 non-null  category      
 46  Yrs (Mat) Bucket        24202 non-null  category      
dtypes: category(2), datetime64[ns](4), float64(26), object(15)
memory usage: 11.9+ MB

[2025-07-04 16:38:14,301] INFO: 
=========================
[2025-07-04 16:38:14,301] INFO: === EXISTING DATE COVERAGE ===
[2025-07-04 16:38:14,301] INFO: =========================
[2025-07-04 16:38:14,301] INFO: Total unique dates in existing data: 14
[2025-07-04 16:38:14,301] INFO: Existing date range: 2023-08-04T00:00:00.000000000 to 2025-06-30T00:00:00.000000000
[2025-07-04 16:38:14,301] INFO: Existing dates in Parquet:
[2025-07-04 16:38:14,302] INFO:   - 2023-08-04: 1897 records
[2025-07-04 16:38:14,302] INFO:   - 2023-10-31: 1987 records
[2025-07-04 16:38:14,302] INFO:   - 2023-12-29: 2061 records
[2025-07-04 16:38:14,302] INFO:   - 2024-12-20: 2353 records
[2025-07-04 16:38:14,303] INFO:   - 2025-05-23: 2664 records
[2025-07-04 16:38:14,303] INFO:   - 2025-05-26: 2665 records
[2025-07-04 16:38:14,303] INFO:   - 2025-05-28: 2672 records
[2025-07-04 16:38:14,303] INFO:   - 2025-06-03: 2704 records
[2025-07-04 16:38:14,304] INFO:   - 2025-06-06: 2710 records
[2025-07-04 16:38:14,304] INFO:   - 2025-06-10: 2714 records
[2025-07-04 16:38:14,304] INFO:   - 2025-06-11: 2715 records
[2025-07-04 16:38:14,304] INFO:   - 2025-06-20: 2742 records
[2025-07-04 16:38:14,306] INFO:   - 2025-06-26: 2247 records
[2025-07-04 16:38:14,306] INFO:   - 2025-06-30: 2247 records
[2025-07-04 16:38:14,306] INFO: 
No new or modified files to process. The Parquet file is up-to-date.
[2025-07-04 16:38:14,307] INFO: Universe processing pipeline finished successfully.
[2025-07-04 16:38:14,952] INFO: Exported processed data to CSV at 'C:\Users\Eddy\YTM Capital Dropbox\Eddy Winiarz\Trading\COF\Models\Unfinished Models\Eddy\Python Projects\work_supa\universe\processed data\universe_processed.csv'.
[2025-07-04 16:43:55,981] INFO: Starting universe processing pipeline...
[2025-07-04 16:43:55,990] DEBUG: Skipping 'API 05.23.25.xlsx' - already processed and unchanged
[2025-07-04 16:43:55,990] DEBUG: Skipping 'API 05.26.25.xlsx' - already processed and unchanged
[2025-07-04 16:43:55,990] DEBUG: Skipping 'API 05.28.25.xlsx' - already processed and unchanged
[2025-07-04 16:43:55,990] DEBUG: Skipping 'API 06.03.25.xlsx' - already processed and unchanged
[2025-07-04 16:43:55,991] DEBUG: Skipping 'API 06.06.25.xlsx' - already processed and unchanged
[2025-07-04 16:43:55,991] DEBUG: Skipping 'API 06.10.25.xlsx' - already processed and unchanged
[2025-07-04 16:43:55,991] DEBUG: Skipping 'API 06.11.25.xlsx' - already processed and unchanged
[2025-07-04 16:43:55,991] DEBUG: Skipping 'API 06.20.25.xlsx' - already processed and unchanged
[2025-07-04 16:43:55,991] DEBUG: Skipping 'API 06.26.25.xlsx' - already processed and unchanged
[2025-07-04 16:43:55,991] DEBUG: Skipping 'API 06.30.25.xlsx' - already processed and unchanged
[2025-07-04 16:43:55,991] DEBUG: Skipping 'API 08.04.23.xlsx' - already processed and unchanged
[2025-07-04 16:43:55,991] DEBUG: Skipping 'API 10.31.23.xlsx' - already processed and unchanged
[2025-07-04 16:43:55,991] DEBUG: Skipping 'API 12.20.24.xlsx' - already processed and unchanged
[2025-07-04 16:43:55,991] DEBUG: Skipping 'API 12.29.23.xlsx' - already processed and unchanged
[2025-07-04 16:43:55,991] INFO: Found existing Parquet file. Loading for incremental processing...
[2025-07-04 16:43:56,100] INFO: Loaded existing data: 34378 rows, 47 columns
[2025-07-04 16:43:56,135] INFO: DataFrame info after loading from Parquet:
<class 'pandas.core.frame.DataFrame'>
RangeIndex: 34378 entries, 0 to 34377
Data columns (total 47 columns):
 #   Column                  Non-Null Count  Dtype         
---  ------                  --------------  -----         
 0   Date                    34378 non-null  datetime64[ns]
 1   CUSIP                   34378 non-null  object        
 2   Benchmark Cusip         34378 non-null  object        
 3   Custom_Sector           34378 non-null  object        
 4   Marketing Sector        34378 non-null  object        
 5   Notes                   34378 non-null  object        
 6   Bloomberg Cusip         34378 non-null  object        
 7   Security                34378 non-null  object        
 8   Benchmark               34378 non-null  object        
 9   Make_Whole              22180 non-null  float64       
 10  Back End                5808 non-null   float64       
 11  Floating Index          34378 non-null  object        
 12  Stochastic Duration     5036 non-null   float64       
 13  Stochastic Convexity    5036 non-null   float64       
 14  Pricing Date            31775 non-null  datetime64[ns]
 15  Pricing Date (Bench)    20670 non-null  datetime64[ns]
 16  MTD Return              28456 non-null  float64       
 17  QTD Return              28094 non-null  float64       
 18  YTD Return              26803 non-null  float64       
 19  MTD Bench Return        19001 non-null  float64       
 20  QTD Bench Return        19069 non-null  float64       
 21  YTD Bench Return        19663 non-null  float64       
 22  Worst Date              31554 non-null  datetime64[ns]
 23  Yrs (Worst)             28676 non-null  float64       
 24  YTC                     28587 non-null  float64       
 25  Excess MTD              26218 non-null  float64       
 26  Excess YTD              23414 non-null  float64       
 27  CPN TYPE                34378 non-null  object        
 28  Ticker                  34378 non-null  object        
 29  G Sprd                  27442 non-null  float64       
 30  Yrs (Cvn)               29652 non-null  float64       
 31  OAS (Mid)               32840 non-null  float64       
 32  Currency                34378 non-null  object        
 33  CAD Equiv Swap          28172 non-null  float64       
 34  G (RBC Crv)             28134 non-null  float64       
 35  vs BI                   21776 non-null  float64       
 36  vs BCE                  28134 non-null  float64       
 37  Equity Ticker           34378 non-null  object        
 38  YTD Equity              24875 non-null  float64       
 39  MTD Equity              24884 non-null  float64       
 40  Yrs Since Issue         25981 non-null  float64       
 41  Risk                    34378 non-null  object        
 42  Rating                  34378 non-null  object        
 43  Yrs (Mat)               24202 non-null  float64       
 44  Z Spread                23230 non-null  float64       
 45  Yrs Since Issue Bucket  25893 non-null  category      
 46  Yrs (Mat) Bucket        24202 non-null  category      
dtypes: category(2), datetime64[ns](4), float64(26), object(15)
memory usage: 11.9+ MB

[2025-07-04 16:43:56,136] INFO: 
=========================
[2025-07-04 16:43:56,136] INFO: === EXISTING DATE COVERAGE ===
[2025-07-04 16:43:56,136] INFO: =========================
[2025-07-04 16:43:56,136] INFO: Total unique dates in existing data: 14
[2025-07-04 16:43:56,136] INFO: Existing date range: 2023-08-04T00:00:00.000000000 to 2025-06-30T00:00:00.000000000
[2025-07-04 16:43:56,136] INFO: Existing dates in Parquet:
[2025-07-04 16:43:56,136] INFO:   - 2023-08-04: 1897 records
[2025-07-04 16:43:56,137] INFO:   - 2023-10-31: 1987 records
[2025-07-04 16:43:56,137] INFO:   - 2023-12-29: 2061 records
[2025-07-04 16:43:56,137] INFO:   - 2024-12-20: 2353 records
[2025-07-04 16:43:56,137] INFO:   - 2025-05-23: 2664 records
[2025-07-04 16:43:56,138] INFO:   - 2025-05-26: 2665 records
[2025-07-04 16:43:56,138] INFO:   - 2025-05-28: 2672 records
[2025-07-04 16:43:56,138] INFO:   - 2025-06-03: 2704 records
[2025-07-04 16:43:56,138] INFO:   - 2025-06-06: 2710 records
[2025-07-04 16:43:56,139] INFO:   - 2025-06-10: 2714 records
[2025-07-04 16:43:56,139] INFO:   - 2025-06-11: 2715 records
[2025-07-04 16:43:56,139] INFO:   - 2025-06-20: 2742 records
[2025-07-04 16:43:56,139] INFO:   - 2025-06-26: 2247 records
[2025-07-04 16:43:56,140] INFO:   - 2025-06-30: 2247 records
[2025-07-04 16:43:56,140] INFO: 
No new or modified files to process. The Parquet file is up-to-date.
[2025-07-04 16:43:56,142] INFO: Universe processing pipeline finished successfully.
[2025-07-04 16:43:56,774] INFO: Exported processed data to CSV at 'C:\Users\Eddy\YTM Capital Dropbox\Eddy Winiarz\Trading\COF\Models\Unfinished Models\Eddy\Python Projects\work_supa\universe\processed data\universe_processed.csv'.
[2025-07-04 16:46:48,119] INFO: Starting universe processing pipeline...
[2025-07-04 16:46:48,121] DEBUG: Skipping 'API 05.23.25.xlsx' - already processed and unchanged
[2025-07-04 16:46:48,121] DEBUG: Skipping 'API 05.26.25.xlsx' - already processed and unchanged
[2025-07-04 16:46:48,129] DEBUG: Skipping 'API 05.28.25.xlsx' - already processed and unchanged
[2025-07-04 16:46:48,129] DEBUG: Skipping 'API 06.03.25.xlsx' - already processed and unchanged
[2025-07-04 16:46:48,129] DEBUG: Skipping 'API 06.06.25.xlsx' - already processed and unchanged
[2025-07-04 16:46:48,129] DEBUG: Skipping 'API 06.10.25.xlsx' - already processed and unchanged
[2025-07-04 16:46:48,129] DEBUG: Skipping 'API 06.11.25.xlsx' - already processed and unchanged
[2025-07-04 16:46:48,129] DEBUG: Skipping 'API 06.20.25.xlsx' - already processed and unchanged
[2025-07-04 16:46:48,129] DEBUG: Skipping 'API 06.26.25.xlsx' - already processed and unchanged
[2025-07-04 16:46:48,129] DEBUG: Skipping 'API 06.30.25.xlsx' - already processed and unchanged
[2025-07-04 16:46:48,129] DEBUG: Skipping 'API 08.04.23.xlsx' - already processed and unchanged
[2025-07-04 16:46:48,129] DEBUG: Skipping 'API 10.31.23.xlsx' - already processed and unchanged
[2025-07-04 16:46:48,129] DEBUG: Skipping 'API 12.20.24.xlsx' - already processed and unchanged
[2025-07-04 16:46:48,129] DEBUG: Skipping 'API 12.29.23.xlsx' - already processed and unchanged
[2025-07-04 16:46:48,129] INFO: Found existing Parquet file. Loading for incremental processing...
[2025-07-04 16:46:48,233] INFO: Loaded existing data: 34378 rows, 47 columns
[2025-07-04 16:46:48,268] INFO: DataFrame info after loading from Parquet:
<class 'pandas.core.frame.DataFrame'>
RangeIndex: 34378 entries, 0 to 34377
Data columns (total 47 columns):
 #   Column                  Non-Null Count  Dtype         
---  ------                  --------------  -----         
 0   Date                    34378 non-null  datetime64[ns]
 1   CUSIP                   34378 non-null  object        
 2   Benchmark Cusip         34378 non-null  object        
 3   Custom_Sector           34378 non-null  object        
 4   Marketing Sector        34378 non-null  object        
 5   Notes                   34378 non-null  object        
 6   Bloomberg Cusip         34378 non-null  object        
 7   Security                34378 non-null  object        
 8   Benchmark               34378 non-null  object        
 9   Make_Whole              22180 non-null  float64       
 10  Back End                5808 non-null   float64       
 11  Floating Index          34378 non-null  object        
 12  Stochastic Duration     5036 non-null   float64       
 13  Stochastic Convexity    5036 non-null   float64       
 14  Pricing Date            31775 non-null  datetime64[ns]
 15  Pricing Date (Bench)    20670 non-null  datetime64[ns]
 16  MTD Return              28456 non-null  float64       
 17  QTD Return              28094 non-null  float64       
 18  YTD Return              26803 non-null  float64       
 19  MTD Bench Return        19001 non-null  float64       
 20  QTD Bench Return        19069 non-null  float64       
 21  YTD Bench Return        19663 non-null  float64       
 22  Worst Date              31554 non-null  datetime64[ns]
 23  Yrs (Worst)             28676 non-null  float64       
 24  YTC                     28587 non-null  float64       
 25  Excess MTD              26218 non-null  float64       
 26  Excess YTD              23414 non-null  float64       
 27  CPN TYPE                34378 non-null  object        
 28  Ticker                  34378 non-null  object        
 29  G Sprd                  27442 non-null  float64       
 30  Yrs (Cvn)               29652 non-null  float64       
 31  OAS (Mid)               32840 non-null  float64       
 32  Currency                34378 non-null  object        
 33  CAD Equiv Swap          28172 non-null  float64       
 34  G (RBC Crv)             28134 non-null  float64       
 35  vs BI                   21776 non-null  float64       
 36  vs BCE                  28134 non-null  float64       
 37  Equity Ticker           34378 non-null  object        
 38  YTD Equity              24875 non-null  float64       
 39  MTD Equity              24884 non-null  float64       
 40  Yrs Since Issue         25981 non-null  float64       
 41  Risk                    34378 non-null  object        
 42  Rating                  34378 non-null  object        
 43  Yrs (Mat)               24202 non-null  float64       
 44  Z Spread                23230 non-null  float64       
 45  Yrs Since Issue Bucket  25893 non-null  category      
 46  Yrs (Mat) Bucket        24202 non-null  category      
dtypes: category(2), datetime64[ns](4), float64(26), object(15)
memory usage: 11.9+ MB

[2025-07-04 16:46:48,269] INFO: 
=========================
[2025-07-04 16:46:48,270] INFO: === EXISTING DATE COVERAGE ===
[2025-07-04 16:46:48,270] INFO: =========================
[2025-07-04 16:46:48,270] INFO: Total unique dates in existing data: 14
[2025-07-04 16:46:48,270] INFO: Existing date range: 2023-08-04T00:00:00.000000000 to 2025-06-30T00:00:00.000000000
[2025-07-04 16:46:48,270] INFO: Existing dates in Parquet:
[2025-07-04 16:46:48,270] INFO:   - 2023-08-04: 1897 records
[2025-07-04 16:46:48,270] INFO:   - 2023-10-31: 1987 records
[2025-07-04 16:46:48,270] INFO:   - 2023-12-29: 2061 records
[2025-07-04 16:46:48,271] INFO:   - 2024-12-20: 2353 records
[2025-07-04 16:46:48,271] INFO:   - 2025-05-23: 2664 records
[2025-07-04 16:46:48,272] INFO:   - 2025-05-26: 2665 records
[2025-07-04 16:46:48,273] INFO:   - 2025-05-28: 2672 records
[2025-07-04 16:46:48,273] INFO:   - 2025-06-03: 2704 records
[2025-07-04 16:46:48,273] INFO:   - 2025-06-06: 2710 records
[2025-07-04 16:46:48,273] INFO:   - 2025-06-10: 2714 records
[2025-07-04 16:46:48,274] INFO:   - 2025-06-11: 2715 records
[2025-07-04 16:46:48,274] INFO:   - 2025-06-20: 2742 records
[2025-07-04 16:46:48,274] INFO:   - 2025-06-26: 2247 records
[2025-07-04 16:46:48,274] INFO:   - 2025-06-30: 2247 records
[2025-07-04 16:46:48,274] INFO: 
No new or modified files to process. The Parquet file is up-to-date.
[2025-07-04 16:46:48,276] INFO: Universe processing pipeline finished successfully.
[2025-07-04 16:46:48,930] INFO: Exported processed data to CSV at 'C:\Users\Eddy\YTM Capital Dropbox\Eddy Winiarz\Trading\COF\Models\Unfinished Models\Eddy\Python Projects\work_supa\universe\processed data\universe_processed.csv'.
[2025-07-04 16:48:59,463] INFO: Starting universe processing pipeline...
[2025-07-04 16:48:59,472] DEBUG: Skipping 'API 05.23.25.xlsx' - already processed and unchanged
[2025-07-04 16:48:59,472] DEBUG: Skipping 'API 05.26.25.xlsx' - already processed and unchanged
[2025-07-04 16:48:59,472] DEBUG: Skipping 'API 05.28.25.xlsx' - already processed and unchanged
[2025-07-04 16:48:59,472] DEBUG: Skipping 'API 06.03.25.xlsx' - already processed and unchanged
[2025-07-04 16:48:59,472] DEBUG: Skipping 'API 06.06.25.xlsx' - already processed and unchanged
[2025-07-04 16:48:59,472] DEBUG: Skipping 'API 06.10.25.xlsx' - already processed and unchanged
[2025-07-04 16:48:59,472] DEBUG: Skipping 'API 06.11.25.xlsx' - already processed and unchanged
[2025-07-04 16:48:59,473] DEBUG: Skipping 'API 06.20.25.xlsx' - already processed and unchanged
[2025-07-04 16:48:59,473] DEBUG: Skipping 'API 06.26.25.xlsx' - already processed and unchanged
[2025-07-04 16:48:59,473] DEBUG: Skipping 'API 06.30.25.xlsx' - already processed and unchanged
[2025-07-04 16:48:59,473] DEBUG: Skipping 'API 08.04.23.xlsx' - already processed and unchanged
[2025-07-04 16:48:59,473] DEBUG: Skipping 'API 10.31.23.xlsx' - already processed and unchanged
[2025-07-04 16:48:59,473] DEBUG: Skipping 'API 12.20.24.xlsx' - already processed and unchanged
[2025-07-04 16:48:59,473] DEBUG: Skipping 'API 12.29.23.xlsx' - already processed and unchanged
[2025-07-04 16:48:59,473] INFO: Found existing Parquet file. Loading for incremental processing...
[2025-07-04 16:48:59,582] INFO: Loaded existing data: 34378 rows, 47 columns
[2025-07-04 16:48:59,620] INFO: DataFrame info after loading from Parquet:
<class 'pandas.core.frame.DataFrame'>
RangeIndex: 34378 entries, 0 to 34377
Data columns (total 47 columns):
 #   Column                  Non-Null Count  Dtype         
---  ------                  --------------  -----         
 0   Date                    34378 non-null  datetime64[ns]
 1   CUSIP                   34378 non-null  object        
 2   Benchmark Cusip         34378 non-null  object        
 3   Custom_Sector           34378 non-null  object        
 4   Marketing Sector        34378 non-null  object        
 5   Notes                   34378 non-null  object        
 6   Bloomberg Cusip         34378 non-null  object        
 7   Security                34378 non-null  object        
 8   Benchmark               34378 non-null  object        
 9   Make_Whole              22180 non-null  float64       
 10  Back End                5808 non-null   float64       
 11  Floating Index          34378 non-null  object        
 12  Stochastic Duration     5036 non-null   float64       
 13  Stochastic Convexity    5036 non-null   float64       
 14  Pricing Date            31775 non-null  datetime64[ns]
 15  Pricing Date (Bench)    20670 non-null  datetime64[ns]
 16  MTD Return              28456 non-null  float64       
 17  QTD Return              28094 non-null  float64       
 18  YTD Return              26803 non-null  float64       
 19  MTD Bench Return        19001 non-null  float64       
 20  QTD Bench Return        19069 non-null  float64       
 21  YTD Bench Return        19663 non-null  float64       
 22  Worst Date              31554 non-null  datetime64[ns]
 23  Yrs (Worst)             28676 non-null  float64       
 24  YTC                     28587 non-null  float64       
 25  Excess MTD              26218 non-null  float64       
 26  Excess YTD              23414 non-null  float64       
 27  CPN TYPE                34378 non-null  object        
 28  Ticker                  34378 non-null  object        
 29  G Sprd                  27442 non-null  float64       
 30  Yrs (Cvn)               29652 non-null  float64       
 31  OAS (Mid)               32840 non-null  float64       
 32  Currency                34378 non-null  object        
 33  CAD Equiv Swap          28172 non-null  float64       
 34  G (RBC Crv)             28134 non-null  float64       
 35  vs BI                   21776 non-null  float64       
 36  vs BCE                  28134 non-null  float64       
 37  Equity Ticker           34378 non-null  object        
 38  YTD Equity              24875 non-null  float64       
 39  MTD Equity              24884 non-null  float64       
 40  Yrs Since Issue         25981 non-null  float64       
 41  Risk                    34378 non-null  object        
 42  Rating                  34378 non-null  object        
 43  Yrs (Mat)               24202 non-null  float64       
 44  Z Spread                23230 non-null  float64       
 45  Yrs Since Issue Bucket  25893 non-null  category      
 46  Yrs (Mat) Bucket        24202 non-null  category      
dtypes: category(2), datetime64[ns](4), float64(26), object(15)
memory usage: 11.9+ MB

[2025-07-04 16:48:59,621] INFO: 
=========================
[2025-07-04 16:48:59,621] INFO: === EXISTING DATE COVERAGE ===
[2025-07-04 16:48:59,621] INFO: =========================
[2025-07-04 16:48:59,621] INFO: Total unique dates in existing data: 14
[2025-07-04 16:48:59,621] INFO: Existing date range: 2023-08-04T00:00:00.000000000 to 2025-06-30T00:00:00.000000000
[2025-07-04 16:48:59,621] INFO: Existing dates in Parquet:
[2025-07-04 16:48:59,622] INFO:   - 2023-08-04: 1897 records
[2025-07-04 16:48:59,622] INFO:   - 2023-10-31: 1987 records
[2025-07-04 16:48:59,622] INFO:   - 2023-12-29: 2061 records
[2025-07-04 16:48:59,622] INFO:   - 2024-12-20: 2353 records
[2025-07-04 16:48:59,623] INFO:   - 2025-05-23: 2664 records
[2025-07-04 16:48:59,623] INFO:   - 2025-05-26: 2665 records
[2025-07-04 16:48:59,623] INFO:   - 2025-05-28: 2672 records
[2025-07-04 16:48:59,624] INFO:   - 2025-06-03: 2704 records
[2025-07-04 16:48:59,624] INFO:   - 2025-06-06: 2710 records
[2025-07-04 16:48:59,624] INFO:   - 2025-06-10: 2714 records
[2025-07-04 16:48:59,624] INFO:   - 2025-06-11: 2715 records
[2025-07-04 16:48:59,624] INFO:   - 2025-06-20: 2742 records
[2025-07-04 16:48:59,625] INFO:   - 2025-06-26: 2247 records
[2025-07-04 16:48:59,625] INFO:   - 2025-06-30: 2247 records
[2025-07-04 16:48:59,625] INFO: 
No new or modified files to process. The Parquet file is up-to-date.
[2025-07-04 16:48:59,626] INFO: Universe processing pipeline finished successfully.
[2025-07-04 16:49:00,298] INFO: Exported processed data to CSV at 'C:\Users\Eddy\YTM Capital Dropbox\Eddy Winiarz\Trading\COF\Models\Unfinished Models\Eddy\Python Projects\work_supa\universe\processed data\universe_processed.csv'.
[2025-07-04 16:54:05,905] INFO: Starting universe processing pipeline...
[2025-07-04 16:54:05,917] DEBUG: Skipping 'API 05.23.25.xlsx' - already processed and unchanged
[2025-07-04 16:54:05,917] DEBUG: Skipping 'API 05.26.25.xlsx' - already processed and unchanged
[2025-07-04 16:54:05,917] DEBUG: Skipping 'API 05.28.25.xlsx' - already processed and unchanged
[2025-07-04 16:54:05,917] DEBUG: Skipping 'API 06.03.25.xlsx' - already processed and unchanged
[2025-07-04 16:54:05,917] DEBUG: Skipping 'API 06.06.25.xlsx' - already processed and unchanged
[2025-07-04 16:54:05,918] DEBUG: Skipping 'API 06.10.25.xlsx' - already processed and unchanged
[2025-07-04 16:54:05,918] DEBUG: Skipping 'API 06.11.25.xlsx' - already processed and unchanged
[2025-07-04 16:54:05,918] DEBUG: Skipping 'API 06.20.25.xlsx' - already processed and unchanged
[2025-07-04 16:54:05,918] DEBUG: Skipping 'API 06.26.25.xlsx' - already processed and unchanged
[2025-07-04 16:54:05,918] DEBUG: Skipping 'API 06.30.25.xlsx' - already processed and unchanged
[2025-07-04 16:54:05,918] DEBUG: Skipping 'API 08.04.23.xlsx' - already processed and unchanged
[2025-07-04 16:54:05,918] DEBUG: Skipping 'API 10.31.23.xlsx' - already processed and unchanged
[2025-07-04 16:54:05,918] DEBUG: Skipping 'API 12.20.24.xlsx' - already processed and unchanged
[2025-07-04 16:54:05,918] DEBUG: Skipping 'API 12.29.23.xlsx' - already processed and unchanged
[2025-07-04 16:54:05,919] INFO: Found existing Parquet file. Loading for incremental processing...
[2025-07-04 16:54:06,049] INFO: Loaded existing data: 34378 rows, 47 columns
[2025-07-04 16:54:06,086] INFO: DataFrame info after loading from Parquet:
<class 'pandas.core.frame.DataFrame'>
RangeIndex: 34378 entries, 0 to 34377
Data columns (total 47 columns):
 #   Column                  Non-Null Count  Dtype         
---  ------                  --------------  -----         
 0   Date                    34378 non-null  datetime64[ns]
 1   CUSIP                   34378 non-null  object        
 2   Benchmark Cusip         34378 non-null  object        
 3   Custom_Sector           34378 non-null  object        
 4   Marketing Sector        34378 non-null  object        
 5   Notes                   34378 non-null  object        
 6   Bloomberg Cusip         34378 non-null  object        
 7   Security                34378 non-null  object        
 8   Benchmark               34378 non-null  object        
 9   Make_Whole              22180 non-null  float64       
 10  Back End                5808 non-null   float64       
 11  Floating Index          34378 non-null  object        
 12  Stochastic Duration     5036 non-null   float64       
 13  Stochastic Convexity    5036 non-null   float64       
 14  Pricing Date            31775 non-null  datetime64[ns]
 15  Pricing Date (Bench)    20670 non-null  datetime64[ns]
 16  MTD Return              28456 non-null  float64       
 17  QTD Return              28094 non-null  float64       
 18  YTD Return              26803 non-null  float64       
 19  MTD Bench Return        19001 non-null  float64       
 20  QTD Bench Return        19069 non-null  float64       
 21  YTD Bench Return        19663 non-null  float64       
 22  Worst Date              31554 non-null  datetime64[ns]
 23  Yrs (Worst)             28676 non-null  float64       
 24  YTC                     28587 non-null  float64       
 25  Excess MTD              26218 non-null  float64       
 26  Excess YTD              23414 non-null  float64       
 27  CPN TYPE                34378 non-null  object        
 28  Ticker                  34378 non-null  object        
 29  G Sprd                  27442 non-null  float64       
 30  Yrs (Cvn)               29652 non-null  float64       
 31  OAS (Mid)               32840 non-null  float64       
 32  Currency                34378 non-null  object        
 33  CAD Equiv Swap          28172 non-null  float64       
 34  G (RBC Crv)             28134 non-null  float64       
 35  vs BI                   21776 non-null  float64       
 36  vs BCE                  28134 non-null  float64       
 37  Equity Ticker           34378 non-null  object        
 38  YTD Equity              24875 non-null  float64       
 39  MTD Equity              24884 non-null  float64       
 40  Yrs Since Issue         25981 non-null  float64       
 41  Risk                    34378 non-null  object        
 42  Rating                  34378 non-null  object        
 43  Yrs (Mat)               24202 non-null  float64       
 44  Z Spread                23230 non-null  float64       
 45  Yrs Since Issue Bucket  25893 non-null  category      
 46  Yrs (Mat) Bucket        24202 non-null  category      
dtypes: category(2), datetime64[ns](4), float64(26), object(15)
memory usage: 11.9+ MB

[2025-07-04 16:54:06,087] INFO: 
=========================
[2025-07-04 16:54:06,088] INFO: === EXISTING DATE COVERAGE ===
[2025-07-04 16:54:06,088] INFO: =========================
[2025-07-04 16:54:06,088] INFO: Total unique dates in existing data: 14
[2025-07-04 16:54:06,088] INFO: Existing date range: 2023-08-04T00:00:00.000000000 to 2025-06-30T00:00:00.000000000
[2025-07-04 16:54:06,088] INFO: Existing dates in Parquet:
[2025-07-04 16:54:06,088] INFO:   - 2023-08-04: 1897 records
[2025-07-04 16:54:06,088] INFO:   - 2023-10-31: 1987 records
[2025-07-04 16:54:06,089] INFO:   - 2023-12-29: 2061 records
[2025-07-04 16:54:06,089] INFO:   - 2024-12-20: 2353 records
[2025-07-04 16:54:06,089] INFO:   - 2025-05-23: 2664 records
[2025-07-04 16:54:06,089] INFO:   - 2025-05-26: 2665 records
[2025-07-04 16:54:06,090] INFO:   - 2025-05-28: 2672 records
[2025-07-04 16:54:06,090] INFO:   - 2025-06-03: 2704 records
[2025-07-04 16:54:06,090] INFO:   - 2025-06-06: 2710 records
[2025-07-04 16:54:06,090] INFO:   - 2025-06-10: 2714 records
[2025-07-04 16:54:06,091] INFO:   - 2025-06-11: 2715 records
[2025-07-04 16:54:06,091] INFO:   - 2025-06-20: 2742 records
[2025-07-04 16:54:06,091] INFO:   - 2025-06-26: 2247 records
[2025-07-04 16:54:06,091] INFO:   - 2025-06-30: 2247 records
[2025-07-04 16:54:06,091] INFO: 
No new or modified files to process. The Parquet file is up-to-date.
[2025-07-04 16:54:06,093] INFO: Universe processing pipeline finished successfully.
[2025-07-04 16:54:06,768] INFO: Exported processed data to CSV at 'C:\Users\Eddy\YTM Capital Dropbox\Eddy Winiarz\Trading\COF\Models\Unfinished Models\Eddy\Python Projects\work_supa\universe\processed data\universe_processed.csv'.
[2025-07-04 16:54:12,550] INFO: Starting universe processing pipeline...
[2025-07-04 16:54:12,559] DEBUG: Skipping 'API 05.23.25.xlsx' - already processed and unchanged
[2025-07-04 16:54:12,559] DEBUG: Skipping 'API 05.26.25.xlsx' - already processed and unchanged
[2025-07-04 16:54:12,559] DEBUG: Skipping 'API 05.28.25.xlsx' - already processed and unchanged
[2025-07-04 16:54:12,559] DEBUG: Skipping 'API 06.03.25.xlsx' - already processed and unchanged
[2025-07-04 16:54:12,559] DEBUG: Skipping 'API 06.06.25.xlsx' - already processed and unchanged
[2025-07-04 16:54:12,560] DEBUG: Skipping 'API 06.10.25.xlsx' - already processed and unchanged
[2025-07-04 16:54:12,560] DEBUG: Skipping 'API 06.11.25.xlsx' - already processed and unchanged
[2025-07-04 16:54:12,560] DEBUG: Skipping 'API 06.20.25.xlsx' - already processed and unchanged
[2025-07-04 16:54:12,560] DEBUG: Skipping 'API 06.26.25.xlsx' - already processed and unchanged
[2025-07-04 16:54:12,560] DEBUG: Skipping 'API 06.30.25.xlsx' - already processed and unchanged
[2025-07-04 16:54:12,560] DEBUG: Skipping 'API 08.04.23.xlsx' - already processed and unchanged
[2025-07-04 16:54:12,560] DEBUG: Skipping 'API 10.31.23.xlsx' - already processed and unchanged
[2025-07-04 16:54:12,560] DEBUG: Skipping 'API 12.20.24.xlsx' - already processed and unchanged
[2025-07-04 16:54:12,560] DEBUG: Skipping 'API 12.29.23.xlsx' - already processed and unchanged
[2025-07-04 16:54:12,560] INFO: Found existing Parquet file. Loading for incremental processing...
[2025-07-04 16:54:12,673] INFO: Loaded existing data: 34378 rows, 47 columns
[2025-07-04 16:54:12,710] INFO: DataFrame info after loading from Parquet:
<class 'pandas.core.frame.DataFrame'>
RangeIndex: 34378 entries, 0 to 34377
Data columns (total 47 columns):
 #   Column                  Non-Null Count  Dtype         
---  ------                  --------------  -----         
 0   Date                    34378 non-null  datetime64[ns]
 1   CUSIP                   34378 non-null  object        
 2   Benchmark Cusip         34378 non-null  object        
 3   Custom_Sector           34378 non-null  object        
 4   Marketing Sector        34378 non-null  object        
 5   Notes                   34378 non-null  object        
 6   Bloomberg Cusip         34378 non-null  object        
 7   Security                34378 non-null  object        
 8   Benchmark               34378 non-null  object        
 9   Make_Whole              22180 non-null  float64       
 10  Back End                5808 non-null   float64       
 11  Floating Index          34378 non-null  object        
 12  Stochastic Duration     5036 non-null   float64       
 13  Stochastic Convexity    5036 non-null   float64       
 14  Pricing Date            31775 non-null  datetime64[ns]
 15  Pricing Date (Bench)    20670 non-null  datetime64[ns]
 16  MTD Return              28456 non-null  float64       
 17  QTD Return              28094 non-null  float64       
 18  YTD Return              26803 non-null  float64       
 19  MTD Bench Return        19001 non-null  float64       
 20  QTD Bench Return        19069 non-null  float64       
 21  YTD Bench Return        19663 non-null  float64       
 22  Worst Date              31554 non-null  datetime64[ns]
 23  Yrs (Worst)             28676 non-null  float64       
 24  YTC                     28587 non-null  float64       
 25  Excess MTD              26218 non-null  float64       
 26  Excess YTD              23414 non-null  float64       
 27  CPN TYPE                34378 non-null  object        
 28  Ticker                  34378 non-null  object        
 29  G Sprd                  27442 non-null  float64       
 30  Yrs (Cvn)               29652 non-null  float64       
 31  OAS (Mid)               32840 non-null  float64       
 32  Currency                34378 non-null  object        
 33  CAD Equiv Swap          28172 non-null  float64       
 34  G (RBC Crv)             28134 non-null  float64       
 35  vs BI                   21776 non-null  float64       
 36  vs BCE                  28134 non-null  float64       
 37  Equity Ticker           34378 non-null  object        
 38  YTD Equity              24875 non-null  float64       
 39  MTD Equity              24884 non-null  float64       
 40  Yrs Since Issue         25981 non-null  float64       
 41  Risk                    34378 non-null  object        
 42  Rating                  34378 non-null  object        
 43  Yrs (Mat)               24202 non-null  float64       
 44  Z Spread                23230 non-null  float64       
 45  Yrs Since Issue Bucket  25893 non-null  category      
 46  Yrs (Mat) Bucket        24202 non-null  category      
dtypes: category(2), datetime64[ns](4), float64(26), object(15)
memory usage: 11.9+ MB

[2025-07-04 16:54:12,711] INFO: 
=========================
[2025-07-04 16:54:12,711] INFO: === EXISTING DATE COVERAGE ===
[2025-07-04 16:54:12,711] INFO: =========================
[2025-07-04 16:54:12,711] INFO: Total unique dates in existing data: 14
[2025-07-04 16:54:12,712] INFO: Existing date range: 2023-08-04T00:00:00.000000000 to 2025-06-30T00:00:00.000000000
[2025-07-04 16:54:12,712] INFO: Existing dates in Parquet:
[2025-07-04 16:54:12,713] INFO:   - 2023-08-04: 1897 records
[2025-07-04 16:54:12,713] INFO:   - 2023-10-31: 1987 records
[2025-07-04 16:54:12,714] INFO:   - 2023-12-29: 2061 records
[2025-07-04 16:54:12,714] INFO:   - 2024-12-20: 2353 records
[2025-07-04 16:54:12,714] INFO:   - 2025-05-23: 2664 records
[2025-07-04 16:54:12,715] INFO:   - 2025-05-26: 2665 records
[2025-07-04 16:54:12,715] INFO:   - 2025-05-28: 2672 records
[2025-07-04 16:54:12,716] INFO:   - 2025-06-03: 2704 records
[2025-07-04 16:54:12,716] INFO:   - 2025-06-06: 2710 records
[2025-07-04 16:54:12,716] INFO:   - 2025-06-10: 2714 records
[2025-07-04 16:54:12,717] INFO:   - 2025-06-11: 2715 records
[2025-07-04 16:54:12,717] INFO:   - 2025-06-20: 2742 records
[2025-07-04 16:54:12,717] INFO:   - 2025-06-26: 2247 records
[2025-07-04 16:54:12,718] INFO:   - 2025-06-30: 2247 records
[2025-07-04 16:54:12,718] INFO: 
No new or modified files to process. The Parquet file is up-to-date.
[2025-07-04 16:54:12,719] INFO: Universe processing pipeline finished successfully.
[2025-07-04 16:54:13,465] INFO: Exported processed data to CSV at 'C:\Users\Eddy\YTM Capital Dropbox\Eddy Winiarz\Trading\COF\Models\Unfinished Models\Eddy\Python Projects\work_supa\universe\processed data\universe_processed.csv'.
[2025-07-19 09:15:54,562] INFO: Starting universe processing pipeline...
[2025-07-19 09:15:54,574] DEBUG: Found modified file to process: 'API 05.23.25.xlsx'
[2025-07-19 09:15:54,574] DEBUG: Found modified file to process: 'API 05.26.25.xlsx'
[2025-07-19 09:15:54,574] DEBUG: Found modified file to process: 'API 05.28.25.xlsx'
[2025-07-19 09:15:54,575] DEBUG: Found modified file to process: 'API 06.03.25.xlsx'
[2025-07-19 09:15:54,575] DEBUG: Found modified file to process: 'API 06.06.25.xlsx'
[2025-07-19 09:15:54,575] DEBUG: Found modified file to process: 'API 06.10.25.xlsx'
[2025-07-19 09:15:54,575] DEBUG: Found modified file to process: 'API 06.11.25.xlsx'
[2025-07-19 09:15:54,575] DEBUG: Found modified file to process: 'API 06.20.25.xlsx'
[2025-07-19 09:15:54,575] DEBUG: Found modified file to process: 'API 06.26.25.xlsx'
[2025-07-19 09:15:54,575] DEBUG: Found modified file to process: 'API 06.30.25.xlsx'
[2025-07-19 09:15:54,575] DEBUG: Found new file to process: 'API 07.11.25.xlsx'
[2025-07-19 09:15:54,576] DEBUG: Found new file to process: 'API 07.16.25.xlsx'
[2025-07-19 09:15:54,576] DEBUG: Found modified file to process: 'API 08.04.23.xlsx'
[2025-07-19 09:15:54,576] DEBUG: Found modified file to process: 'API 10.31.23.xlsx'
[2025-07-19 09:15:54,576] DEBUG: Found modified file to process: 'API 12.20.24.xlsx'
[2025-07-19 09:15:54,576] DEBUG: Found modified file to process: 'API 12.29.23.xlsx'
[2025-07-19 09:15:54,576] INFO: Found existing Parquet file. Loading for incremental processing...
[2025-07-19 09:15:54,885] INFO: Loaded existing data: 34378 rows, 47 columns
[2025-07-19 09:15:54,920] INFO: DataFrame info after loading from Parquet:
<class 'pandas.core.frame.DataFrame'>
RangeIndex: 34378 entries, 0 to 34377
Data columns (total 47 columns):
 #   Column                  Non-Null Count  Dtype         
---  ------                  --------------  -----         
 0   Date                    34378 non-null  datetime64[ns]
 1   CUSIP                   34378 non-null  object        
 2   Benchmark Cusip         34378 non-null  object        
 3   Custom_Sector           34378 non-null  object        
 4   Marketing Sector        34378 non-null  object        
 5   Notes                   34378 non-null  object        
 6   Bloomberg Cusip         34378 non-null  object        
 7   Security                34378 non-null  object        
 8   Benchmark               34378 non-null  object        
 9   Make_Whole              22180 non-null  float64       
 10  Back End                5808 non-null   float64       
 11  Floating Index          34378 non-null  object        
 12  Stochastic Duration     5036 non-null   float64       
 13  Stochastic Convexity    5036 non-null   float64       
 14  Pricing Date            31775 non-null  datetime64[ns]
 15  Pricing Date (Bench)    20670 non-null  datetime64[ns]
 16  MTD Return              28456 non-null  float64       
 17  QTD Return              28094 non-null  float64       
 18  YTD Return              26803 non-null  float64       
 19  MTD Bench Return        19001 non-null  float64       
 20  QTD Bench Return        19069 non-null  float64       
 21  YTD Bench Return        19663 non-null  float64       
 22  Worst Date              31554 non-null  datetime64[ns]
 23  Yrs (Worst)             28676 non-null  float64       
 24  YTC                     28587 non-null  float64       
 25  Excess MTD              26218 non-null  float64       
 26  Excess YTD              23414 non-null  float64       
 27  CPN TYPE                34378 non-null  object        
 28  Ticker                  34378 non-null  object        
 29  G Sprd                  27442 non-null  float64       
 30  Yrs (Cvn)               29652 non-null  float64       
 31  OAS (Mid)               32840 non-null  float64       
 32  Currency                34378 non-null  object        
 33  CAD Equiv Swap          28172 non-null  float64       
 34  G (RBC Crv)             28134 non-null  float64       
 35  vs BI                   21776 non-null  float64       
 36  vs BCE                  28134 non-null  float64       
 37  Equity Ticker           34378 non-null  object        
 38  YTD Equity              24875 non-null  float64       
 39  MTD Equity              24884 non-null  float64       
 40  Yrs Since Issue         25981 non-null  float64       
 41  Risk                    34378 non-null  object        
 42  Rating                  34378 non-null  object        
 43  Yrs (Mat)               24202 non-null  float64       
 44  Z Spread                23230 non-null  float64       
 45  Yrs Since Issue Bucket  25893 non-null  category      
 46  Yrs (Mat) Bucket        24202 non-null  category      
dtypes: category(2), datetime64[ns](4), float64(26), object(15)
memory usage: 11.9+ MB

[2025-07-19 09:15:54,921] INFO: 
=========================
[2025-07-19 09:15:54,921] INFO: === EXISTING DATE COVERAGE ===
[2025-07-19 09:15:54,921] INFO: =========================
[2025-07-19 09:15:54,922] INFO: Total unique dates in existing data: 14
[2025-07-19 09:15:54,922] INFO: Existing date range: 2023-08-04T00:00:00.000000000 to 2025-06-30T00:00:00.000000000
[2025-07-19 09:15:54,922] INFO: Existing dates in Parquet:
[2025-07-19 09:15:54,922] INFO:   - 2023-08-04: 1897 records
[2025-07-19 09:15:54,922] INFO:   - 2023-10-31: 1987 records
[2025-07-19 09:15:54,923] INFO:   - 2023-12-29: 2061 records
[2025-07-19 09:15:54,923] INFO:   - 2024-12-20: 2353 records
[2025-07-19 09:15:54,923] INFO:   - 2025-05-23: 2664 records
[2025-07-19 09:15:54,924] INFO:   - 2025-05-26: 2665 records
[2025-07-19 09:15:54,924] INFO:   - 2025-05-28: 2672 records
[2025-07-19 09:15:54,924] INFO:   - 2025-06-03: 2704 records
[2025-07-19 09:15:54,924] INFO:   - 2025-06-06: 2710 records
[2025-07-19 09:15:54,925] INFO:   - 2025-06-10: 2714 records
[2025-07-19 09:15:54,925] INFO:   - 2025-06-11: 2715 records
[2025-07-19 09:15:54,925] INFO:   - 2025-06-20: 2742 records
[2025-07-19 09:15:54,925] INFO:   - 2025-06-26: 2247 records
[2025-07-19 09:15:54,926] INFO:   - 2025-06-30: 2247 records
[2025-07-19 09:15:54,926] INFO: 
Found 16 files to process...
[2025-07-19 09:15:54,926] INFO: Processing 'API 05.23.25.xlsx'...
[2025-07-19 09:15:54,926] INFO:   Extracted date: 2025-05-23 (datetime type)
[2025-07-19 09:15:56,622] INFO:   Added Date column with dtype: datetime64[ns]
[2025-07-19 09:15:56,622] INFO:   Processed shape: (2714, 76)
[2025-07-19 09:15:56,622] INFO: Processing 'API 05.26.25.xlsx'...
[2025-07-19 09:15:56,622] INFO:   Extracted date: 2025-05-26 (datetime type)
[2025-07-19 09:15:57,774] INFO:   Added Date column with dtype: datetime64[ns]
[2025-07-19 09:15:57,774] INFO:   Processed shape: (2715, 76)
[2025-07-19 09:15:57,774] INFO: Processing 'API 05.28.25.xlsx'...
[2025-07-19 09:15:57,774] INFO:   Extracted date: 2025-05-28 (datetime type)
[2025-07-19 09:15:58,923] INFO:   Added Date column with dtype: datetime64[ns]
[2025-07-19 09:15:58,923] INFO:   Processed shape: (2722, 76)
[2025-07-19 09:15:58,923] INFO: Processing 'API 06.03.25.xlsx'...
[2025-07-19 09:15:58,923] INFO:   Extracted date: 2025-06-03 (datetime type)
[2025-07-19 09:16:00,073] INFO:   Added Date column with dtype: datetime64[ns]
[2025-07-19 09:16:00,073] INFO:   Processed shape: (2754, 76)
[2025-07-19 09:16:00,073] INFO: Processing 'API 06.06.25.xlsx'...
[2025-07-19 09:16:00,073] INFO:   Extracted date: 2025-06-06 (datetime type)
[2025-07-19 09:16:01,260] INFO:   Added Date column with dtype: datetime64[ns]
[2025-07-19 09:16:01,260] INFO:   Processed shape: (2760, 76)
[2025-07-19 09:16:01,260] INFO: Processing 'API 06.10.25.xlsx'...
[2025-07-19 09:16:01,260] INFO:   Extracted date: 2025-06-10 (datetime type)
[2025-07-19 09:16:02,426] INFO:   Added Date column with dtype: datetime64[ns]
[2025-07-19 09:16:02,426] INFO:   Processed shape: (2764, 76)
[2025-07-19 09:16:02,426] INFO: Processing 'API 06.11.25.xlsx'...
[2025-07-19 09:16:02,426] INFO:   Extracted date: 2025-06-11 (datetime type)
[2025-07-19 09:16:03,573] INFO:   Added Date column with dtype: datetime64[ns]
[2025-07-19 09:16:03,575] INFO:   Processed shape: (2765, 76)
[2025-07-19 09:16:03,575] INFO: Processing 'API 06.20.25.xlsx'...
[2025-07-19 09:16:03,575] INFO:   Extracted date: 2025-06-20 (datetime type)
[2025-07-19 09:16:04,727] INFO:   Added Date column with dtype: datetime64[ns]
[2025-07-19 09:16:04,727] INFO:   Processed shape: (2794, 76)
[2025-07-19 09:16:04,727] INFO: Processing 'API 06.26.25.xlsx'...
[2025-07-19 09:16:04,727] INFO:   Extracted date: 2025-06-26 (datetime type)
[2025-07-19 09:16:05,711] INFO:   Added Date column with dtype: datetime64[ns]
[2025-07-19 09:16:05,711] INFO:   Processed shape: (2294, 76)
[2025-07-19 09:16:05,711] INFO: Processing 'API 06.30.25.xlsx'...
[2025-07-19 09:16:05,711] INFO:   Extracted date: 2025-06-30 (datetime type)
[2025-07-19 09:16:06,682] INFO:   Added Date column with dtype: datetime64[ns]
[2025-07-19 09:16:06,682] INFO:   Processed shape: (2294, 76)
[2025-07-19 09:16:06,682] INFO: Processing 'API 07.11.25.xlsx'...
[2025-07-19 09:16:06,682] INFO:   Extracted date: 2025-07-11 (datetime type)
[2025-07-19 09:16:07,678] INFO:   Added Date column with dtype: datetime64[ns]
[2025-07-19 09:16:07,678] INFO:   Processed shape: (2299, 76)
[2025-07-19 09:16:07,678] INFO: Processing 'API 07.16.25.xlsx'...
[2025-07-19 09:16:07,679] INFO:   Extracted date: 2025-07-16 (datetime type)
[2025-07-19 09:16:08,677] INFO:   Added Date column with dtype: datetime64[ns]
[2025-07-19 09:16:08,678] INFO:   Processed shape: (2337, 76)
[2025-07-19 09:16:08,678] INFO: Processing 'API 08.04.23.xlsx'...
[2025-07-19 09:16:08,678] INFO:   Extracted date: 2023-08-04 (datetime type)
[2025-07-19 09:16:09,351] INFO:   Added Date column with dtype: datetime64[ns]
[2025-07-19 09:16:09,351] INFO:   Processed shape: (1929, 60)
[2025-07-19 09:16:09,351] INFO: Processing 'API 10.31.23.xlsx'...
[2025-07-19 09:16:09,351] INFO:   Extracted date: 2023-10-31 (datetime type)
[2025-07-19 09:16:10,048] INFO:   Added Date column with dtype: datetime64[ns]
[2025-07-19 09:16:10,048] INFO:   Processed shape: (2020, 60)
[2025-07-19 09:16:10,048] INFO: Processing 'API 12.20.24.xlsx'...
[2025-07-19 09:16:10,048] INFO:   Extracted date: 2024-12-20 (datetime type)
[2025-07-19 09:16:11,064] INFO:   Added Date column with dtype: datetime64[ns]
[2025-07-19 09:16:11,064] INFO:   Processed shape: (2400, 76)
[2025-07-19 09:16:11,064] INFO: Processing 'API 12.29.23.xlsx'...
[2025-07-19 09:16:11,065] INFO:   Extracted date: 2023-12-29 (datetime type)
[2025-07-19 09:16:11,808] INFO:   Added Date column with dtype: datetime64[ns]
[2025-07-19 09:16:11,808] INFO:   Processed shape: (2097, 61)
[2025-07-19 09:16:11,915] INFO: 
--- Starting Data Processing Pipeline ---
[2025-07-19 09:16:12,000] INFO: Dropped 0 rows with null CUSIPs.
[2025-07-19 09:16:12,097] INFO: Dropped 741 duplicate (Date, CUSIP) rows.
[2025-07-19 09:16:12,097] INFO: --- Running Data Validation and Quality Analysis ---
[2025-07-19 09:16:13,505] WARNING: 
=========================
=== VALIDATION ERRORS ===
=========================

--- Non-Numeric Data in Numeric Columns ---
  - Column 'Stochastic Duration': Found 32177 non-numeric entries.
  - Column 'Stochastic Convexity': Found 32177 non-numeric entries.
  - Column 'MTD Return': Found 2725 non-numeric entries.
  - Column 'QTD Return': Found 2410 non-numeric entries.
  - Column 'YTD Return': Found 1572 non-numeric entries.
  - Column 'MTD Bench Return': Found 1778 non-numeric entries.
  - Column 'QTD Bench Return': Found 1710 non-numeric entries.
  - Column 'YTD Bench Return': Found 1044 non-numeric entries.
  - Column 'Yrs (Worst)': Found 5826 non-numeric entries.
  - Column 'YTC': Found 2631 non-numeric entries.
  - Column 'G Sprd': Found 3240 non-numeric entries.
  - Column 'Yrs (Cvn)': Found 4781 non-numeric entries.
  - Column 'OAS (Mid)': Found 1649 non-numeric entries.
  - Column 'CAD Equiv Swap': Found 2618 non-numeric entries.
  - Column 'Yrs Since Issue': Found 2493 non-numeric entries.
  - Column 'Yrs (Mat)': Found 4306 non-numeric entries.
  - Column 'Z Spread': Found 5394 non-numeric entries.
[2025-07-19 09:16:13,517] INFO: 
=========================
=== DATA QUALITY REPORT ===
=========================

--- Null Value Analysis (Top 5) ---
  - BI Interp: 38917.0 nulls (100.00%)
  - B/E Bench Sprd: 38917.0 nulls (100.00%)
  - Forward Sprd: 38917.0 nulls (100.00%)
  - Yrs (Mat) Bucket: 38917.0 nulls (100.00%)
  - Yrs Since Issue Bucket: 38917.0 nulls (100.00%)

--- Statistical Summary (Numeric Columns) ---
                          count          mean             std        min     25%     50%     75%                max
Stochastic Duration    5,833.00          3.82            2.97       0.00    1.75    3.16    4.93              15.83
Stochastic Convexity   5,833.00         -1.50            5.47     -92.61   -0.05    0.04    0.15               6.95
MTD Return            32,818.00          0.00            9.97     -22.95   -0.40    0.01    0.29           1,784.13
QTD Return            32,456.00          0.37           14.75     -26.98   -0.45    0.32    0.72           1,784.13
YTD Return            30,663.00          2.50           20.64     -50.93    1.29    2.08    2.90           2,170.15
MTD Bench Return      21,738.00         -0.68            1.85      -5.99   -1.00   -0.26    0.03               8.08
QTD Bench Return      21,806.00         -1.14            3.86      -9.64   -1.87   -0.34    0.26              19.62
YTD Bench Return      22,472.00          0.16            3.23      -8.81   -0.73    1.41    1.71              11.66
Yrs (Worst)           32,904.00        104.65          241.01  -3,354.73   36.85   79.06  123.95           8,115.43
YTC                   32,883.00          4.73            2.37     -27.45    3.79    4.67    5.26              77.92
Excess MTD            30,300.00          0.36            0.65     -17.66    0.03    0.17    0.52              17.46
Excess YTD            26,961.00          0.66            1.84     -27.16    0.03    0.38    1.07              41.60
G Sprd                31,650.00  6,785,239.01  381,664,043.26  -7,195.32   73.62  113.47  158.95  21,474,836,480.00
Yrs (Cvn)             34,136.00          7.61            8.90       0.00    1.86    4.02    8.44              57.71
OAS (Mid)             37,251.00        159.92          167.86    -455.83  119.26  156.10  158.53           5,334.99
CAD Equiv Swap        32,402.00        122.83          230.90  -2,972.81   59.64   99.48  135.21           6,326.82
YTD Equity            28,357.00          7.15           14.51     -87.32   -1.02    5.66   13.90             181.24
MTD Equity            28,366.00          1.24            5.35     -37.86   -1.85    0.42    3.82              46.33
Yrs Since Issue       30,479.00          3.85            3.45      -0.05    1.26    3.16    5.20              30.88
Risk                  27,632.00        497.60          423.41       0.27  179.09  367.09  698.65           2,064.86
Yrs (Mat)             28,666.00          9.86           12.52       0.00    2.20    4.67   10.25              60.29
Z Spread              27,518.00        148.37          259.95  -3,153.15   78.60  121.44  163.01           8,160.01

--- Categorical Value Distribution (Sample) ---
  - Column 'CUSIP':
    '45075EAB0': 16 (0.04%)
    '95040QAK0': 16 (0.04%)
    '48128G7D6': 16 (0.04%)
  - Column 'Benchmark Cusip':
    '135087M68': 4582 (11.77%)
    '135087F82': 1261 (3.24%)
    '135087H23': 1072 (2.75%)
  - Column 'Custom_Sector':
    'Auto': 3622 (9.31%)
    'Utility': 3271 (8.41%)
    'Financial Maples': 3247 (8.34%)
[2025-07-19 09:16:13,518] DEBUG: Creating bucket for 'Yrs Since Issue'...
[2025-07-19 09:16:13,518] DEBUG: Creating bucket for 'Yrs (Mat)'...
[2025-07-19 09:16:13,692] INFO: 
=========================
=== FINAL DATA SNAPSHOT ===
=========================
Total Rows: 38917
Total Columns: 47
Memory Usage: 79.27 MB

--- DataFrame Info ---
<class 'pandas.core.frame.DataFrame'>
Int64Index: 38917 entries, 31525 to 28996
Columns: 47 entries, Date to Yrs (Mat) Bucket
dtypes: category(2), datetime64[ns](1), object(44)
memory usage: 13.7+ MB

[2025-07-19 09:16:14,805] INFO: --- Processing Complete ---
[2025-07-19 09:16:14,805] INFO: Final DataFrame Shape: (38917, 47)
[2025-07-19 09:16:14,805] INFO: 
=========================
[2025-07-19 09:16:14,805] INFO: === DATE COVERAGE ANALYSIS ===
[2025-07-19 09:16:14,809] INFO: =========================
[2025-07-19 09:16:14,809] INFO: Total unique dates: 16
[2025-07-19 09:16:14,809] INFO: Date column dtype: datetime64[ns]
[2025-07-19 09:16:14,809] INFO: Date range: 2023-08-04 to 2025-07-16
[2025-07-19 09:16:14,809] INFO: Time span: 712 days (1.9 years)
[2025-07-19 09:16:14,840] INFO: 
Year distribution:
[2025-07-19 09:16:14,840] INFO:   - 2023: 5945 records
[2025-07-19 09:16:14,840] INFO:   - 2024: 2353 records
[2025-07-19 09:16:14,840] INFO:   - 2025: 30619 records
[2025-07-19 09:16:14,861] INFO: 
Business day analysis:
[2025-07-19 09:16:14,861] INFO:   - Business days: 38917 (100.0%)
[2025-07-19 09:16:14,861] INFO:   - Weekend days: 0 (0.0%)
[2025-07-19 09:16:14,861] INFO: 
Sample dates:
[2025-07-19 09:16:14,861] INFO:   - 2023-08-04 (Fri): 1897 records
[2025-07-19 09:16:14,861] INFO:   - 2023-10-31 (Tue): 1987 records
[2025-07-19 09:16:14,866] INFO:   - 2023-12-29 (Fri): 2061 records
[2025-07-19 09:16:14,866] INFO:   - 2024-12-20 (Fri): 2353 records
[2025-07-19 09:16:14,866] INFO:   - 2025-05-23 (Fri): 2664 records
[2025-07-19 09:16:14,866] INFO:   ... (6 more dates) ...
[2025-07-19 09:16:14,866] INFO:   - 2025-06-20 (Fri): 2742 records
[2025-07-19 09:16:14,866] INFO:   - 2025-06-26 (Thu): 2247 records
[2025-07-19 09:16:14,866] INFO:   - 2025-06-30 (Mon): 2247 records
[2025-07-19 09:16:14,866] INFO:   - 2025-07-11 (Fri): 2251 records
[2025-07-19 09:16:14,866] INFO:   - 2025-07-16 (Wed): 2288 records
[2025-07-19 09:16:14,866] INFO: 
=== END DATE ANALYSIS ===

[2025-07-19 09:16:14,902] INFO: DataFrame info before saving to Parquet:
<class 'pandas.core.frame.DataFrame'>
Int64Index: 38917 entries, 31525 to 28996
Data columns (total 47 columns):
 #   Column                  Non-Null Count  Dtype         
---  ------                  --------------  -----         
 0   Date                    38917 non-null  datetime64[ns]
 1   CUSIP                   38917 non-null  object        
 2   Benchmark Cusip         38917 non-null  object        
 3   Custom_Sector           38917 non-null  object        
 4   Marketing Sector        38917 non-null  object        
 5   Notes                   38917 non-null  object        
 6   Bloomberg Cusip         38917 non-null  object        
 7   Security                38917 non-null  object        
 8   Benchmark               38917 non-null  object        
 9   Make_Whole              25383 non-null  float64       
 10  Back End                6717 non-null   float64       
 11  Floating Index          38917 non-null  object        
 12  Stochastic Duration     5833 non-null   float64       
 13  Stochastic Convexity    5833 non-null   float64       
 14  Pricing Date            36274 non-null  datetime64[ns]
 15  Pricing Date (Bench)    23541 non-null  datetime64[ns]
 16  MTD Return              32818 non-null  float64       
 17  QTD Return              32456 non-null  float64       
 18  YTD Return              30663 non-null  float64       
 19  MTD Bench Return        21738 non-null  float64       
 20  QTD Bench Return        21806 non-null  float64       
 21  YTD Bench Return        22472 non-null  float64       
 22  Worst Date              36045 non-null  datetime64[ns]
 23  Yrs (Worst)             32904 non-null  float64       
 24  YTC                     32883 non-null  float64       
 25  Excess MTD              30300 non-null  float64       
 26  Excess YTD              26961 non-null  float64       
 27  CPN TYPE                38917 non-null  object        
 28  Ticker                  38917 non-null  object        
 29  G Sprd                  31650 non-null  float64       
 30  Yrs (Cvn)               34136 non-null  float64       
 31  OAS (Mid)               37251 non-null  float64       
 32  Currency                38917 non-null  object        
 33  CAD Equiv Swap          32402 non-null  float64       
 34  G (RBC Crv)             32362 non-null  float64       
 35  vs BI                   25126 non-null  float64       
 36  vs BCE                  32362 non-null  float64       
 37  Equity Ticker           38917 non-null  object        
 38  YTD Equity              28357 non-null  float64       
 39  MTD Equity              28366 non-null  float64       
 40  Yrs Since Issue         30479 non-null  float64       
 41  Risk                    38917 non-null  object        
 42  Rating                  38917 non-null  object        
 43  Yrs (Mat)               28666 non-null  float64       
 44  Z Spread                27518 non-null  float64       
 45  Yrs Since Issue Bucket  30385 non-null  category      
 46  Yrs (Mat) Bucket        28666 non-null  category      
dtypes: category(2), datetime64[ns](4), float64(26), object(15)
memory usage: 13.7+ MB

[2025-07-19 09:16:15,020] INFO: Successfully saved updated DataFrame to 'C:\Users\Eddy\YTM Capital Dropbox\Eddy Winiarz\Trading\COF\Models\Unfinished Models\Eddy\Python Projects\work_supa\universe\universe.parquet'.
[2025-07-19 09:16:15,020] INFO: Updated processing state file.
[2025-07-19 09:16:15,109] INFO: Universe processing pipeline finished successfully.
[2025-07-19 09:16:15,853] INFO: Exported processed data to CSV at 'C:\Users\Eddy\YTM Capital Dropbox\Eddy Winiarz\Trading\COF\Models\Unfinished Models\Eddy\Python Projects\work_supa\universe\processed data\universe_processed.csv'.
[2025-07-19 09:26:11,120] INFO: Starting universe processing pipeline...
[2025-07-19 09:26:11,130] DEBUG: Skipping 'API 05.23.25.xlsx' - already processed and unchanged
[2025-07-19 09:26:11,130] DEBUG: Skipping 'API 05.26.25.xlsx' - already processed and unchanged
[2025-07-19 09:26:11,130] DEBUG: Skipping 'API 05.28.25.xlsx' - already processed and unchanged
[2025-07-19 09:26:11,130] DEBUG: Skipping 'API 06.03.25.xlsx' - already processed and unchanged
[2025-07-19 09:26:11,130] DEBUG: Skipping 'API 06.06.25.xlsx' - already processed and unchanged
[2025-07-19 09:26:11,130] DEBUG: Skipping 'API 06.10.25.xlsx' - already processed and unchanged
[2025-07-19 09:26:11,130] DEBUG: Skipping 'API 06.11.25.xlsx' - already processed and unchanged
[2025-07-19 09:26:11,130] DEBUG: Skipping 'API 06.20.25.xlsx' - already processed and unchanged
[2025-07-19 09:26:11,130] DEBUG: Skipping 'API 06.26.25.xlsx' - already processed and unchanged
[2025-07-19 09:26:11,130] DEBUG: Skipping 'API 06.30.25.xlsx' - already processed and unchanged
[2025-07-19 09:26:11,130] DEBUG: Skipping 'API 07.11.25.xlsx' - already processed and unchanged
[2025-07-19 09:26:11,130] DEBUG: Skipping 'API 07.16.25.xlsx' - already processed and unchanged
[2025-07-19 09:26:11,130] DEBUG: Skipping 'API 08.04.23.xlsx' - already processed and unchanged
[2025-07-19 09:26:11,130] DEBUG: Skipping 'API 10.31.23.xlsx' - already processed and unchanged
